Gurobi 12.0.3:   lim:time = 14400

  mip:bestbound = 1

Set parameter LogToConsole to value 1

  tech:outlev = 1

Set parameter Cuts to value 3

  cut:cuts = 3

Set parameter Presolve to value 2

  pre:solve = 2

Set parameter MIPFocus to value 2

  mip:focus = 2

Set parameter Symmetry to value 2

  mip:symmetry = 2

Set parameter InfUnbdInfo to value 1

Gurobi Optimizer version 12.0.3 build v12.0.3rc0 (win64 - Windows 10.0 (19045.2))



CPU model: Intel(R) Core(TM) i7-10700 CPU @ 2.90GHz, instruction set [SSE2|AVX|AVX2]

Thread count: 8 physical cores, 16 logical processors, using up to 16 threads



Non-default parameters:

TimeLimit  14400

MIPFocus  2

Symmetry  2

Cuts  3

InfUnbdInfo  1

Presolve  2



Optimize a model with 491 rows, 1165 columns and 6724 nonzeros

Model fingerprint: 0xe421451b

Model has 2 quadratic objective terms

Model has 6 quadratic constraints

Variable types: 42 continuous, 1123 integer (0 binary)

Coefficient statistics:

  Matrix range     [1e+00, 1e+05]

  QMatrix range    [1e+00, 1e+00]

  QLMatrix range   [1e+00, 1e+01]

  Objective range  [4e+00, 1e+02]

  QObjective range [2e+00, 2e+00]

  Bounds range     [1e+00, 1e+02]

  RHS range        [1e+00, 1e+05]

  QRHS range       [1e+02, 1e+02]

Presolve removed 38 rows and 99 columns

Presolve time: 0.26s

Presolved: 1176 rows, 1780 columns, 10788 nonzeros

Variable types: 139 continuous, 1641 integer (1391 binary)

Root relaxation presolve removed 22 rows and 1 columns

Root relaxation presolved: 797 rows, 1423 columns, 16415 nonzeros





Root relaxation: objective 1.080487e+02, 195 iterations, 0.02 seconds (0.02 work units)



    Nodes    |    Current Node    |     Objective Bounds      |     Work

 Expl Unexpl |  Obj  Depth IntInf | Incumbent    BestBd   Gap | It/Node Time



     0     0  108.04872    0   53          -  108.04872      -     -    0s

H    0     0                     726.9900000  108.04872  85.1%     -    0s

H    0     0                     669.6200000  108.04872  83.9%     -    0s

H    0     0                     656.6200000  108.04872  83.5%     -    0s

     0     0  138.37295    0   93  656.62000  138.37295  78.9%     -    0s

H    0     0                     424.6000000  138.37295  67.4%     -    0s

     0     0  138.37295    0   86  424.60000  138.37295  67.4%     -    0s

H    0     0                     413.0200000  138.68019  66.4%     -    0s

H    0     0                     397.8400000  138.68019  65.1%     -    0s

     0     0  138.68019    0   41  397.84000  138.68019  65.1%     -    1s

     0     0  138.68019    0   41  397.84000  138.68019  65.1%     -    1s

H    0     0                     392.9400000  138.69113  64.7%     -    1s

     0     0  138.69113    0   59  392.94000  138.69113  64.7%     -    1s

     0     0  138.69553    0   67  392.94000  138.69553  64.7%     -    1s

H    0     0                     391.5000000  138.69553  64.6%     -    1s

H    0     0                     386.6400000  138.69553  64.1%     -    1s

H    0     0                     380.1500000  147.36067  61.2%     -    1s

     0     0  147.36067    0   58  380.15000  147.36067  61.2%     -    1s

     0     0  147.82200    0   59  380.15000  147.82200  61.1%     -    1s

H    0     0                     339.8000000  147.82200  56.5%     -    1s

     0     0  182.89887    0   80  339.80000  182.89887  46.2%     -    1s

     0     0  192.59551    0   83  339.80000  192.59551  43.3%     -    1s

     0     0  194.90052    0   69  339.80000  194.90052  42.6%     -    1s

     0     0  194.90052    0   69  339.80000  194.90052  42.6%     -    2s

H    0     0                     327.8700000  194.90052  40.6%     -    2s

     0     0  194.90052    0   60  327.87000  194.90052  40.6%     -    2s

     0     0  196.86603    0   74  327.87000  196.86603  40.0%     -    2s

     0     0  198.31503    0   77  327.87000  198.31503  39.5%     -    2s

H    0     0                     324.8800000  206.31505  36.5%     -    2s

     0     0  206.31505    0   45  324.88000  206.31505  36.5%     -    2s

H    0     0                     323.6100000  206.31505  36.2%     -    2s

     0     0  206.31505    0   44  323.61000  206.31505  36.2%     -    2s

     0     0  208.24073    0  102  323.61000  208.24073  35.7%     -    2s

     0     0  208.24073    0  101  323.61000  208.24073  35.7%     -    2s

     0     2  208.24147    0  102  323.61000  208.24147  35.7%     -    3s

H  136   146                     318.7700000  208.56005  34.6%  20.7    3s

H  141   146                     316.3900000  208.56005  34.1%  20.4    3s

  2362  1404  265.11612   36   52  316.39000  208.70065  34.0%  15.5    5s

  2393  1426  270.26054   52   73  316.39000  212.20667  32.9%  16.5   10s

  2410  1437  212.57536   10   78  316.39000  212.57536  32.8%  16.4   15s

  4260  1938  214.81680   38   33  316.39000  212.94000  32.7%  21.8   20s

 16353  6554 infeasible   56       316.39000  217.89269  31.1%  23.5   25s

 27749 11250  221.56685   43   57  316.39000  220.13723  30.4%  24.4   30s

 35825 14578  291.17181   51   36  316.39000  220.97667  30.2%  25.2   35s

 42624 17895 infeasible   50       316.39000  221.65593  29.9%  25.8   41s

 52107 20468 infeasible   58       316.39000  222.78522  29.6%  26.0   45s

 61345 23478  246.08530   51   51  316.39000  223.59543  29.3%  26.1   50s

 69852 25778  225.50386   45   25  316.39000  224.59203  29.0%  26.2   55s

 77253 28810  280.30504   54   19  316.39000  225.25571  28.8%  26.1   60s

 85825 31559  272.25057   64   38  316.39000  225.87066  28.6%  26.2   65s

 91743 33492  240.08959   43   21  316.39000  226.33055  28.5%  26.3   70s

 99012 35628 infeasible   46       316.39000  226.64300  28.4%  26.4   75s

 104610 37109  234.08603   34   41  316.39000  227.11313  28.2%  26.5   81s

 110378 38815  281.56500   51   16  316.39000  227.53006  28.1%  26.6   86s

 115986 40395  306.29700   54   40  316.39000  227.86677  28.0%  26.8   90s

 123565 42289  228.58601   45   25  316.39000  228.39102  27.8%  26.7   96s

 128039 43742  228.75017   38   38  316.39000  228.70997  27.7%  26.7  100s

 134535 45773 infeasible   47       316.39000  228.96502  27.6%  26.8  105s

 141979 47633  233.74324   43   61  316.39000  229.52593  27.5%  26.9  111s

 145916 48685  262.23559   45   51  316.39000  229.70189  27.4%  26.9  115s

 153300 50240 infeasible   60       316.39000  230.11955  27.3%  27.0  120s

 160528 52116  238.79089   55   43  316.39000  230.61569  27.1%  27.0  125s

 169459 54050 infeasible   54       316.39000  231.10150  27.0%  27.1  130s

 178039 56074  291.44917   49   43  316.39000  231.67110  26.8%  27.1  135s

 186831 58053  282.54917   48   63  316.39000  232.20657  26.6%  27.1  140s

 195569 59605 infeasible   54       316.39000  232.71596  26.4%  27.2  145s

 203579 61585 infeasible   45       316.39000  233.19744  26.3%  27.2  150s

H206453 61801                     314.9600000  233.32383  25.9%  27.2  151s

H207651 61896                     314.7500000  233.42728  25.8%  27.2  152s

 210031 62506  236.92287   46   26  314.75000  233.59248  25.8%  27.2  155s

 218532 63990  287.45000   42   33  314.75000  234.15658  25.6%  27.3  160s

 227205 65493  281.78251   46   17  314.75000  234.71009  25.4%  27.4  166s

 233889 66829 infeasible   43       314.75000  235.08773  25.3%  27.5  170s

 240141 67672 infeasible   42       314.75000  235.50576  25.2%  27.5  175s

 248735 68852  295.48600   39   56  314.75000  236.16287  25.0%  27.6  180s

 255659 69728 infeasible   43       314.75000  236.73930  24.8%  27.7  185s

 263767 70943 infeasible   54       314.75000  237.26987  24.6%  27.7  191s

 270196 71541 infeasible   44       314.75000  237.64208  24.5%  27.8  195s

 277503 72151 infeasible   44       314.75000  238.15422  24.3%  27.9  200s

 285050 72829  253.50000   41   30  314.75000  238.78683  24.1%  28.0  205s

 292460 73768 infeasible   57       314.75000  239.31065  24.0%  28.0  210s

 299654 74439 infeasible   39       314.75000  239.77822  23.8%  28.0  215s

 306691 75154  295.27106   48   81  314.75000  240.28307  23.7%  28.1  220s

 313800 75686  284.04278   47   47  314.75000  240.82736  23.5%  28.2  225s

 320139 76234  268.16039   54   30  314.75000  241.27233  23.3%  28.2  230s

 326869 76681  260.71038   45   62  314.75000  241.82603  23.2%  28.3  235s

 332988 76848 infeasible   40       314.75000  242.36165  23.0%  28.4  241s

 337880 77095  278.92205   43   51  314.75000  242.72132  22.9%  28.4  245s

 344666 77403     cutoff   52       314.75000  243.19444  22.7%  28.5  250s

 351462 77745 infeasible   47       314.75000  243.69760  22.6%  28.6  256s

 356808 77964 infeasible   45       314.75000  244.15551  22.4%  28.6  260s

 363556 78259 infeasible   42       314.75000  244.72911  22.2%  28.7  265s

 368362 78495  280.79673   43   22  314.75000  245.09775  22.1%  28.7  270s

 375267 78943  298.62381   51   25  314.75000  245.69524  21.9%  28.8  275s

 380755 79155 infeasible   46       314.75000  246.16378  21.8%  28.8  280s

 387394 79604  259.23423   49   44  314.75000  246.71388  21.6%  28.8  285s

 393637 79693 infeasible   48       314.75000  247.16866  21.5%  28.9  291s

 398521 80027  277.48654   63   42  314.75000  247.54323  21.4%  28.9  295s

 405697 80292 infeasible   52       314.75000  248.11343  21.2%  28.9  301s

 410210 80435 infeasible   45       314.75000  248.43865  21.1%  29.0  305s

 415828 80631  284.62904   47   21  314.75000  248.86344  20.9%  29.0  310s

 420439 80764     cutoff   47       314.75000  249.23233  20.8%  29.0  315s

 426008 80848 infeasible   46       314.75000  249.65968  20.7%  29.1  320s

 432684 80926  271.67250   38   31  314.75000  250.18415  20.5%  29.2  326s

 437610 81113  250.82993   46   25  314.75000  250.54128  20.4%  29.2  330s

 442713 81239  274.14071   51   33  314.75000  250.91991  20.3%  29.2  335s

 447889 81375 infeasible   52       314.75000  251.30346  20.2%  29.2  340s

 453712 81381  310.92695   60   49  314.75000  251.74056  20.0%  29.3  345s

 458961 81344  280.38000   41   17  314.75000  252.20035  19.9%  29.3  350s

 466082 81519 infeasible   50       314.75000  252.69475  19.7%  29.3  356s

 470454 81604  263.33894   52   85  314.75000  253.03638  19.6%  29.4  360s

 476271 81508     cutoff   59       314.75000  253.49552  19.5%  29.4  365s

 481518 81386 infeasible   35       314.75000  253.87250  19.3%  29.4  370s

 486290 81189 infeasible   51       314.75000  254.19623  19.2%  29.5  375s

 491780 81047  273.41617   44   66  314.75000  254.74087  19.1%  29.5  380s

 497024 80808  267.21500   46   39  314.75000  255.08821  19.0%  29.5  385s

 502959 80334 infeasible   43       314.75000  255.66530  18.8%  29.6  391s

 508454 79924  303.98667   43   43  314.75000  256.19935  18.6%  29.6  395s

 513180 79582 infeasible   46       314.75000  256.55383  18.5%  29.6  400s

 520585 79056 infeasible   50       314.75000  257.20617  18.3%  29.7  406s

 525459 78915  286.20510   46   61  314.75000  257.63100  18.1%  29.7  410s

 531850 78491 infeasible   51       314.75000  258.18529  18.0%  29.7  416s

 536410 78239  307.87015   50   42  314.75000  258.52105  17.9%  29.8  420s

 541427 77824  274.63250   38   36  314.75000  258.99838  17.7%  29.8  425s

 548091 77186  287.45202   55   34  314.75000  259.49508  17.6%  29.9  431s

 553455 76718  273.01072   41   40  314.75000  260.01040  17.4%  29.9  435s

 558577 76195     cutoff   40       314.75000  260.44270  17.3%  29.9  440s

 564495 75174  306.64572   53   28  314.75000  261.02895  17.1%  30.0  446s

 569921 74287  301.89286   45   42  314.75000  261.57586  16.9%  30.0  451s

 574935 73427 infeasible   42       314.75000  262.05237  16.7%  30.0  455s

 580129 72566 infeasible   55       314.75000  262.68021  16.5%  30.1  460s

 586732 71485 infeasible   57       314.75000  263.38166  16.3%  30.2  466s

 590327 70872 infeasible   51       314.75000  263.75013  16.2%  30.2  470s

 595498 70154     cutoff   38       314.75000  264.30650  16.0%  30.2  475s

 601622 69153 infeasible   56       314.75000  264.94242  15.8%  30.3  481s

 605814 68026 infeasible   48       314.75000  265.34806  15.7%  30.3  486s

 611323 66869  283.39896   54   49  314.75000  265.93387  15.5%  30.3  491s

 616488 65740  300.18277   48   70  314.75000  266.49582  15.3%  30.3  495s

 621858 64499 infeasible   47       314.75000  267.20373  15.1%  30.4  500s

 626332 63350  292.65993   50   22  314.75000  267.55693  15.0%  30.4  505s

 631738 62027 infeasible   55       314.75000  268.51511  14.7%  30.4  510s

 637066 60702  282.32973   45   86  314.75000  269.20279  14.5%  30.5  515s

 642288 59482 infeasible   49       314.75000  269.87000  14.3%  30.5  520s

 647105 58123  303.39792   44   38  314.75000  270.51000  14.1%  30.5  525s

 652257 56428 infeasible   55       314.75000  271.28601  13.8%  30.6  530s

 658147 54798     cutoff   51       314.75000  272.06923  13.6%  30.6  536s

 663279 53335 infeasible   53       314.75000  272.77902  13.3%  30.6  541s

 668653 51766  310.68455   52   22  314.75000  273.52416  13.1%  30.6  546s

 673730 50294 infeasible   49       314.75000  274.28800  12.9%  30.6  551s

 679086 49237 infeasible   56       314.75000  275.16991  12.6%  30.6  555s

 684391 47041  308.05082   61    6  314.75000  275.95083  12.3%  30.7  561s

 689332 45540 infeasible   48       314.75000  276.76619  12.1%  30.7  566s

 694080 43889  309.90767   48   46  314.75000  277.59504  11.8%  30.7  571s

 699164 42026 infeasible   47       314.75000  278.50162  11.5%  30.7  575s

 703540 40586     cutoff   50       314.75000  279.18300  11.3%  30.7  580s

 709089 38712  291.87784   55   31  314.75000  280.16000  11.0%  30.7  586s

 714385 36673 infeasible   50       314.75000  281.15393  10.7%  30.8  591s

 719777 34822 infeasible   53       314.75000  282.29049  10.3%  30.8  596s

 725032 33036 infeasible   61       314.75000  283.25969  10.0%  30.8  601s

 730013 31005 infeasible   47       314.75000  284.38000  9.65%  30.8  606s

 735251 29099     cutoff   51       314.75000  285.44457  9.31%  30.8  611s

 740397 27278 infeasible   46       314.75000  286.46533  8.99%  30.8  616s

 743617 26047 infeasible   53       314.75000  287.29625  8.72%  30.8  620s

 748955 23948 infeasible   58       314.75000  288.70500  8.27%  30.8  625s

 754060 22104 infeasible   57       314.75000  289.99667  7.86%  30.8  630s

 759213 20136 infeasible   62       314.75000  291.38161  7.42%  30.8  635s

 764515 18070  310.78452   41   44  314.75000  292.79068  6.98%  30.7  641s

 769474 16051 infeasible   42       314.75000  294.26524  6.51%  30.7  646s

 773007 14718 infeasible   37       314.75000  295.19629  6.21%  30.7  650s

 778287 12773 infeasible   55       314.75000  296.97184  5.65%  30.7  656s

 781691 11387 infeasible   47       314.75000  297.87156  5.36%  30.7  660s

 786971  8995  305.79326   45   41  314.75000  300.07201  4.66%  30.6  665s

 790501  8073     cutoff   40       314.75000  301.59000  4.18%  30.6  671s

 792458  6914 infeasible   53       314.75000  301.74124  4.13%  30.6  675s

 797903  3762  314.25000   54   38  314.75000  305.39617  2.97%  30.6  681s

 801847  1254  309.94678   69   22  314.75000  308.50000  1.99%  30.5  687s



Cutting planes:

  Learned: 4

  Gomory: 32

  Lift-and-project: 15

  Cover: 260

  Implied bound: 130

  Projected implied bound: 7

  Clique: 191

  MIR: 137

  Mixing: 1

  StrongCG: 40

  Flow cover: 437

  GUB cover: 2

  Inf proof: 217

  Zero half: 841

  RLT: 39

  Relax-and-lift: 505



Explored 805419 nodes (24538908 simplex iterations) in 690.07 seconds (274.87 work units)

Thread count was 16 (of 16 available processors)



Solution count 10: 314.75 314.75 314.96 ... 380.15



Optimal solution found (tolerance 1.00e-04)

Best objective 3.147500000000e+02, best bound 3.147500000000e+02, gap 0.0000%



AMPL MP initial flat model has 1165 variables (0 integer, 1123 binary);

Objectives: 1 quadratic; 

Constraints:  491 linear; 6 quadratic;



AMPL MP final model has 1165 variables (0 integer, 1123 binary);

Objectives: 1 quadratic; 

Constraints:  491 linear; 6 quadratic;





-----RESULTS INFO-----
running_time:  690.234
TC.best_bound:  314.75
TC:  314.75
MIP Gap (%):  0
=== Vehicle Routes ===
Vehicle 1: 0 → 14
Vehicle 1: 1 → 21
Vehicle 1: 2 → 1
Vehicle 1: 14 → 2
Vehicle 2: 0 → 17
Vehicle 2: 3 → 21
Vehicle 2: 17 → 19
Vehicle 2: 19 → 3
Vehicle 3: 0 → 21
Vehicle 4: 0 → 21

=== Full Vehicle Routes ===
Vehicle 1: 0 → 14 → 2 → 1 → 0 (62<100)
Vehicle 2: 0 → 17 → 19 → 3 → 0 (98<100)
Vehicle 3: 0 → 0 (0<100)
Vehicle 4: 0 → 0 (0<100)
Arc used by MRT line: y variables:
MRT used: 14 → 15
Customer assigment to PL: u variables:
4 14
5 19
6 17
7 14
8 15
9 19
10 19
11 17
12 19
13 17
Node is served by regular vehicle: g variables:
1
2
3
14
17
19
Customer assigment to Home delivery: gm variables:
1
2
3
Node total demands: ntd variables:
1 13 1
2 12 1
3 13 1
9 0 0
10 0 0
11 0 0
12 0 0
13 0 0
20 0 0
14 37 1
15 0 0
16 0 0
17 33 1
18 0 0
19 52 1
Customer's demand delivered to PL: l variables:
4
5
6
7
8
9
10
11
12
13
Lockers load <= capacity:
0 <= 71
25 <= 74
12 <= 98
0 <= 84
33 <= 82
0 <= 93
52 <= 73
