Gurobi 12.0.3:   lim:time = 14400

  mip:bestbound = 1

Set parameter LogToConsole to value 1

  tech:outlev = 1

Set parameter Cuts to value 3

  cut:cuts = 3

Set parameter Presolve to value 2

  pre:solve = 2

Set parameter MIPFocus to value 2

  mip:focus = 2

Set parameter Symmetry to value 2

  mip:symmetry = 2

Set parameter InfUnbdInfo to value 1

Gurobi Optimizer version 12.0.3 build v12.0.3rc0 (win64 - Windows 11.0 (26100.2))



CPU model: 12th Gen Intel(R) Core(TM) i7-12700, instruction set [SSE2|AVX|AVX2]

Thread count: 12 physical cores, 20 logical processors, using up to 20 threads



Non-default parameters:

TimeLimit  14400

MIPFocus  2

Symmetry  2

Cuts  3

InfUnbdInfo  1

Presolve  2



Optimize a model with 488 rows, 1162 columns and 6715 nonzeros

Model fingerprint: 0xfd3574d7

Model has 4 quadratic objective terms

Model has 8 quadratic constraints

Variable types: 41 continuous, 1121 integer (0 binary)

Coefficient statistics:

  Matrix range     [1e+00, 1e+05]

  QMatrix range    [1e+00, 1e+00]

  QLMatrix range   [1e+00, 1e+01]

  Objective range  [4e+00, 1e+02]

  QObjective range [2e+00, 2e+00]

  Bounds range     [1e+00, 1e+02]

  RHS range        [1e+00, 1e+05]

  QRHS range       [1e+02, 1e+02]

Presolve removed 33 rows and 87 columns

Presolve time: 0.19s

Presolved: 1133 rows, 1739 columns, 10717 nonzeros

Variable types: 262 continuous, 1477 integer (1409 binary)

Root relaxation presolve removed 23 rows and 3 columns

Root relaxation presolved: 743 rows, 1371 columns, 17124 nonzeros





Root relaxation: objective 7.781231e+01, 189 iterations, 0.02 seconds (0.02 work units)



    Nodes    |    Current Node    |     Objective Bounds      |     Work

 Expl Unexpl |  Obj  Depth IntInf | Incumbent    BestBd   Gap | It/Node Time



     0     0   77.81231    0   53          -   77.81231      -     -    0s

     0     0  122.52088    0   83          -  122.52088      -     -    0s

     0     0  122.52088    0  115          -  122.52088      -     -    0s

     0     0  122.52088    0   81          -  122.52088      -     -    0s

H    0     0                     763.6900000  122.52088  84.0%     -    0s

H    0     0                     759.8600000  122.52088  83.9%     -    0s

H    0     0                     514.7200000  122.52088  76.2%     -    0s

H    0     0                     406.1700000  127.35751  68.6%     -    0s

H    0     0                     396.3700000  127.35751  67.9%     -    0s

     0     0  127.35751    0   67  396.37000  127.35751  67.9%     -    0s

H    0     0                     380.7200000  131.56256  65.4%     -    0s

     0     0  131.56256    0   82  380.72000  131.56256  65.4%     -    0s

     0     0  131.56256    0   82  380.72000  131.56256  65.4%     -    0s

H    0     0                     362.6800000  142.63613  60.7%     -    1s

H    0     0                     362.4700000  142.63613  60.6%     -    1s

H    0     0                     359.5000000  142.63613  60.3%     -    1s

     0     0  142.63613    0   61  359.50000  142.63613  60.3%     -    1s

     0     0  142.66278    0   61  359.50000  142.66278  60.3%     -    1s

     0     2  142.66278    0   61  359.50000  142.66278  60.3%     -    1s

H  229   234                     357.6000000  142.85000  60.1%  22.3    1s

H  301   300                     348.5400000  142.85000  59.0%  20.8    1s

H  313   300                     337.0300000  142.85000  57.6%  20.4    1s

H 1535  1162                     336.1500000  142.88530  57.5%  14.9    2s

H 2719  1632                     333.3900000  150.05000  55.0%  15.6    4s

  2723  1634  182.18514   21  117  333.39000  150.05000  55.0%  15.6    5s

  2743  1648  183.09594   49  104  333.39000  170.89273  48.7%  15.5   10s

H 2775  1584                     323.8200000  176.66814  45.4%  15.3   13s

H 2776  1505                     317.3800000  176.66814  44.3%  15.3   13s

H 2776  1428                     314.4100000  176.66814  43.8%  15.3   13s

  2801  1446  300.04940   24  109  314.41000  176.66814  43.8%  19.1   15s

H 2819  1384                     306.9200000  218.47251  28.8%  19.0   18s

H 2819  1315                     306.6900000  218.61474  28.7%  19.0   18s

  2831  1323  273.23570   17  183  306.69000  221.41015  27.8%  18.9   20s

  7278  1845 infeasible   49       306.69000  222.71500  27.4%  25.9   25s

 19543  4805  258.79030   45   45  306.69000  236.34578  22.9%  24.7   30s

 28090  6230     cutoff   47       306.69000  243.83715  20.5%  24.9   35s

 36886  7402  276.09625   56   42  306.69000  251.09484  18.1%  24.9   40s

 43406  8302     cutoff   45       306.69000  254.81960  16.9%  25.0   45s

 49989  9016 infeasible   48       306.69000  258.00899  15.9%  25.1   50s

 59072 10062 infeasible   52       306.69000  261.19763  14.8%  24.8   55s

 64650 10512  280.93899   56   72  306.69000  263.69830  14.0%  24.8   60s

 72864 10701  270.11654   39   51  306.69000  266.21789  13.2%  24.9   65s

 78994 10741  288.24745   49   51  306.69000  268.36703  12.5%  24.8   70s

 85087 10760  289.17565   59   37  306.69000  270.56384  11.8%  24.8   75s

 90957 10485     cutoff   52       306.69000  272.68503  11.1%  24.8   80s

 97486 10102  281.58611   40   62  306.69000  275.01719  10.3%  24.7   85s

 106050  9427  293.45222   45   38  306.69000  277.88667  9.39%  24.5   91s

 112855  8801  287.91510   61   62  306.69000  279.97713  8.71%  24.3   95s

 121762  7369  290.96286   40   44  306.69000  283.09483  7.69%  24.2  100s

 130853  5438 infeasible   49       306.69000  286.85082  6.47%  23.9  105s

 139646  3197     cutoff   44       306.69000  291.04867  5.10%  23.6  110s



Cutting planes:

  Learned: 8

  Gomory: 26

  Lift-and-project: 11

  Cover: 133

  Implied bound: 175

  Projected implied bound: 21

  Clique: 132

  MIR: 96

  Mixing: 5

  Flow cover: 276

  GUB cover: 3

  Inf proof: 69

  Zero half: 308

  RLT: 38

  Relax-and-lift: 123



Explored 148029 nodes (3435272 simplex iterations) in 114.59 seconds (53.40 work units)

Thread count was 20 (of 20 available processors)



Solution count 10: 306.69 306.69 306.92 ... 348.54



Optimal solution found (tolerance 1.00e-04)

Best objective 3.066900000000e+02, best bound 3.066900000000e+02, gap 0.0000%



AMPL MP initial flat model has 1162 variables (0 integer, 1121 binary);

Objectives: 1 quadratic; 

Constraints:  488 linear; 8 quadratic;



AMPL MP final model has 1162 variables (0 integer, 1121 binary);

Objectives: 1 quadratic; 

Constraints:  488 linear; 8 quadratic;





-----RESULTS INFO-----
running_time:  114.67200000000001
TC.best_bound:  306.6899999999999
TC:  306.69
MIP Gap (%):  3.7068974443775806e-14
=== Vehicle Routes ===
Vehicle 1: 0 → 1
Vehicle 1: 1 → 2
Vehicle 1: 2 → 13
Vehicle 1: 13 → 20
Vehicle 2: 0 → 16
Vehicle 2: 3 → 20
Vehicle 2: 4 → 3
Vehicle 2: 16 → 4
Vehicle 3: 0 → 20
Vehicle 4: 0 → 20

=== Full Vehicle Routes ===
Vehicle 1: 0 → 1 → 2 → 13 → 0 (93<100)
Vehicle 2: 0 → 16 → 4 → 3 → 0 (91<100)
Vehicle 3: 0 → 0 (0<100)
Vehicle 4: 0 → 0 (0<100)
Arc used by MRT line: y variables:
MRT used: 13 → 14
MRT used: 16 → 15
Customer assigment to PL: u variables:
5 13
6 16
7 16
8 14
9 14
10 14
11 16
12 15
Node is served by regular vehicle: g variables:
1
2
3
4
13
16
Customer assigment to Home delivery: gm variables:
1
2
3
4
Node total demands: ntd variables:
1 13 1
2 12 1
3 13 1
4 12 1
9 0 0
10 0 0
11 0 0
12 0 0
19 0 0
13 68 1
14 0 0
15 0 0
16 66 1
17 0 0
18 0 0
Customer's demand delivered to PL: l variables:
5
6
7
8
9
10
11
12
Lockers load <= capacity:
0 <= 73
12 <= 85
56 <= 81
24 <= 96
42 <= 74
0 <= 82
0 <= 96
