Gurobi 12.0.3:   lim:time = 14400

  mip:bestbound = 1

Set parameter LogToConsole to value 1

  tech:outlev = 1

Set parameter Cuts to value 3

  cut:cuts = 3

Set parameter Presolve to value 2

  pre:solve = 2

Set parameter MIPFocus to value 2

  mip:focus = 2

Set parameter Symmetry to value 2

  mip:symmetry = 2

Set parameter InfUnbdInfo to value 1

Gurobi Optimizer version 12.0.3 build v12.0.3rc0 (win64 - Windows 10.0 (19045.2))



CPU model: Intel(R) Core(TM) i7-10700 CPU @ 2.90GHz, instruction set [SSE2|AVX|AVX2]

Thread count: 8 physical cores, 16 logical processors, using up to 16 threads



Non-default parameters:

TimeLimit  14400

MIPFocus  2

Symmetry  2

Cuts  3

InfUnbdInfo  1

Presolve  2



Optimize a model with 536 rows, 1309 columns and 7609 nonzeros

Model fingerprint: 0x67f94818

Model has 6 quadratic objective terms

Model has 10 quadratic constraints

Variable types: 43 continuous, 1266 integer (0 binary)

Coefficient statistics:

  Matrix range     [1e+00, 1e+05]

  QMatrix range    [1e+00, 1e+00]

  QLMatrix range   [1e+00, 2e+01]

  Objective range  [3e+00, 1e+02]

  QObjective range [2e+00, 2e+00]

  Bounds range     [1e+00, 1e+02]

  RHS range        [1e+00, 1e+05]

  QRHS range       [1e+02, 1e+02]

Presolve removed 28 rows and 88 columns

Presolve time: 0.59s

Presolved: 1301 rows, 1995 columns, 12252 nonzeros

Variable types: 412 continuous, 1583 integer (1508 binary)

Root relaxation presolve removed 24 rows and 4 columns

Root relaxation presolved: 950 rows, 1666 columns, 19913 nonzeros





Root relaxation: objective 8.881063e+01, 193 iterations, 0.05 seconds (0.03 work units)



    Nodes    |    Current Node    |     Objective Bounds      |     Work

 Expl Unexpl |  Obj  Depth IntInf | Incumbent    BestBd   Gap | It/Node Time



     0     0   88.81063    0   58          -   88.81063      -     -    1s

H    0     0                     647.9800000   89.78482  86.1%     -    1s

     0     0  167.49016    0   75  647.98000  167.49016  74.2%     -    1s

     0     0  167.49016    0   48  647.98000  167.49016  74.2%     -    1s

     0     0  167.49016    0   48  647.98000  167.49016  74.2%     -    1s

     0     0  177.39054    0   47  647.98000  177.39054  72.6%     -    1s

     0     0  177.39054    0   38  647.98000  177.39054  72.6%     -    1s

H    0     0                     604.4000000  185.52500  69.3%     -    2s

H    0     0                     601.7400000  185.52500  69.2%     -    2s

H    0     0                     591.2500000  185.52500  68.6%     -    2s

H    0     0                     580.4600000  185.52500  68.0%     -    2s

H    0     0                     453.8100000  185.52500  59.1%     -    2s

     0     0  185.52500    0   79  453.81000  185.52500  59.1%     -    2s

     0     0  186.45406    0   54  453.81000  186.45406  58.9%     -    2s

     0     0  190.78884    0   70  453.81000  190.78884  58.0%     -    2s

     0     0  190.92633    0   60  453.81000  190.92633  57.9%     -    3s

     0     2  190.95654    0   51  453.81000  190.95654  57.9%     -    3s

H   26    52                     439.1100000  194.85000  55.6%  57.1    3s

H  164   149                     438.3000000  194.85000  55.5%  37.4    3s

H  203   193                     429.3000000  194.85000  54.6%  34.4    3s

H  239   228                     421.1200000  194.85000  53.7%  32.4    3s

H  248   239                     412.1200000  194.85000  52.7%  32.0    3s

*  426   404              42     392.0000000  194.85000  50.3%  24.3    4s

*  428   404              41     388.1300000  194.85000  49.8%  24.2    4s

*  499   432              56     380.9000000  194.85000  48.8%  23.5    4s

H  824   652                     373.9000000  195.38919  47.7%  24.5    4s

H 1388   991                     362.7500000  195.84951  46.0%  23.5    4s

  1392  1050  228.25701   18   60  362.75000  195.84951  46.0%  23.6    5s

  1908  1330  320.03984   26   58  362.75000  197.91904  45.4%  22.5   10s

H 2133  1408                     359.8700000  198.33245  44.9%  27.0   12s

H 2142  1342                     356.5300000  198.33245  44.4%  27.1   12s

H 4162  1757                     351.4200000  204.55736  41.8%  25.4   14s

  6137  2442  316.80737   39   10  351.42000  206.65321  41.2%  24.1   15s

*10025  4582              53     350.7500000  208.99000  40.4%  22.7   16s

H10819  4798                     350.5400000  209.40238  40.3%  22.4   16s

H10998  4502                     319.6000000  209.40238  34.5%  22.3   17s

 14282  5612  231.85340   25   56  319.60000  211.78021  33.7%  23.1   20s

 21395  7795 infeasible   39       319.60000  216.43353  32.3%  24.4   25s

 27716  9698  245.92005   30  101  319.60000  220.64661  31.0%  25.2   30s

 35446 12257  232.92045   18   70  319.60000  225.59172  29.4%  25.9   35s

 43852 14931  256.28373   29   62  319.60000  229.20869  28.3%  26.4   40s

 51332 17307  255.22123   45   19  319.60000  232.19213  27.3%  26.6   45s

 59881 19706  250.64366   27   71  319.60000  234.71081  26.6%  26.8   50s

 68645 21915  254.57382   27   67  319.60000  237.26429  25.8%  27.0   55s

 76920 24004  308.94332   36   29  319.60000  239.48580  25.1%  27.1   60s

 85912 26072     cutoff   43       319.60000  241.59891  24.4%  27.2   65s

 94225 27935 infeasible   41       319.60000  243.56365  23.8%  27.3   70s

 102848 29922  297.83212   38   39  319.60000  245.40183  23.2%  27.5   75s

 112012 32050  270.76679   33   49  319.60000  247.07598  22.7%  27.7   80s

 120663 33959  290.18710   27   21  319.60000  248.52083  22.2%  27.8   85s

 130557 35957  288.09302   35   26  319.60000  250.35184  21.7%  27.8   90s

 138881 37603  275.38230   37   92  319.60000  251.76951  21.2%  27.8   95s

 148007 39392     cutoff   47       319.60000  253.31500  20.7%  27.8  100s

 155886 40728  305.80955   35   38  319.60000  254.57263  20.3%  27.9  105s

 164088 42166  313.08388   19   75  319.60000  255.77223  20.0%  28.0  110s

 171738 43414  281.74030   32   23  319.60000  257.04520  19.6%  28.0  115s

 179227 44611  310.19000   37   54  319.60000  258.04986  19.3%  28.0  120s

 187746 45894  272.50018   34   64  319.60000  259.24445  18.9%  28.0  125s

 196138 47115     cutoff   44       319.60000  260.40082  18.5%  28.0  130s

 203813 48037  300.27197   31   70  319.60000  261.48303  18.2%  28.1  135s

 211510 49092 infeasible   43       319.60000  262.40394  17.9%  28.1  140s

 220098 50090  316.11888   34   20  319.60000  263.42142  17.6%  28.1  145s

 227709 51056  302.42789   47   24  319.60000  264.24223  17.3%  28.1  150s

 235477 51841  293.61512   36   70  319.60000  265.23873  17.0%  28.1  155s

 243914 52846  310.02875   29   21  319.60000  266.11239  16.7%  28.1  160s

 250772 53491 infeasible   26       319.60000  266.93375  16.5%  28.1  165s

 256555 54075  306.24967   30   31  319.60000  267.52956  16.3%  28.1  170s

 264832 54754  282.58878   39   61  319.60000  268.44503  16.0%  28.1  175s

 272477 55369 infeasible   34       319.60000  269.16502  15.8%  28.1  180s

 279903 55868     cutoff   40       319.60000  269.92261  15.5%  28.1  185s

 287449 56345  309.14775   34   71  319.60000  270.69343  15.3%  28.1  190s

 294858 56853 infeasible   28       319.60000  271.46143  15.1%  28.1  195s

 302525 57402     cutoff   35       319.60000  272.14214  14.8%  28.1  200s

 310127 57904     cutoff   28       319.60000  272.81381  14.6%  28.1  205s

 317449 58236  282.33663   34   60  319.60000  273.51667  14.4%  28.1  210s

 324765 58421  294.83111   39   16  319.60000  274.17498  14.2%  28.1  215s

 330568 58660  293.78620   23   85  319.60000  274.76106  14.0%  28.1  220s

 337687 58844  315.16033   37   36  319.60000  275.46622  13.8%  28.1  225s

 343600 58937  301.08791   52   28  319.60000  275.97657  13.6%  28.1  230s

 351186 59008  294.63000   34   25  319.60000  276.64773  13.4%  28.1  235s

 357573 58898  286.22055   39   26  319.60000  277.28000  13.2%  28.1  240s

 364926 58748  293.37148   48   18  319.60000  277.98000  13.0%  28.1  245s

 371523 58739     cutoff   43       319.60000  278.58555  12.8%  28.1  250s

 378263 58442     cutoff   38       319.60000  279.23348  12.6%  28.1  255s

 385234 58237  301.51273   46   44  319.60000  279.84875  12.4%  28.1  260s

 392072 58071     cutoff   41       319.60000  280.47302  12.2%  28.1  265s

 399020 57787  293.27567   31   47  319.60000  281.07825  12.1%  28.1  270s

 405058 57524 infeasible   36       319.60000  281.62788  11.9%  28.1  275s

 411874 57151  312.04647   53   58  319.60000  282.21241  11.7%  28.1  280s

 417901 56856  305.67147   41   88  319.60000  282.72218  11.5%  28.1  285s

 424427 56363 infeasible   40       319.60000  283.23862  11.4%  28.1  290s

 431335 56079  304.01750   23   57  319.60000  283.83064  11.2%  28.0  295s

 435998 55783  294.92969   44   37  319.60000  284.17648  11.1%  28.0  300s

 442235 55330  293.61333   34   20  319.60000  284.76261  10.9%  28.0  305s

 448298 54869  290.53345   36   95  319.60000  285.30259  10.7%  28.0  310s

 455285 54399 infeasible   46       319.60000  285.85213  10.6%  28.0  315s

 461401 53943  294.45704   40   58  319.60000  286.37055  10.4%  28.0  320s

 468244 53427 infeasible   47       319.60000  286.85754  10.2%  28.0  325s

 474364 52858  310.31848   42   75  319.60000  287.33629  10.1%  28.0  330s

 480127 52330  294.99941   46   34  319.60000  287.80903  9.95%  28.0  335s

 486972 51661 infeasible   49       319.60000  288.36392  9.77%  27.9  340s

 493116 51102     cutoff   43       319.60000  288.81494  9.63%  27.9  345s

 498919 50463 infeasible   45       319.60000  289.28131  9.49%  27.9  350s

 504949 49761  312.22750   22   69  319.60000  289.80125  9.32%  27.9  355s

 511058 49182  297.66030   48   33  319.60000  290.25011  9.18%  27.9  360s

 517146 48396  294.03679   35   31  319.60000  290.76296  9.02%  27.8  365s

 523253 47644  310.55594   28   46  319.60000  291.21350  8.88%  27.8  370s

 529269 46865     cutoff   45       319.60000  291.69513  8.73%  27.8  375s

 534151 46423  311.75372   39   27  319.60000  292.05667  8.62%  27.8  380s

 540211 45526  304.42396   73   27  319.60000  292.55326  8.46%  27.8  385s

 546239 44756     cutoff   48       319.60000  292.99572  8.32%  27.8  390s

 552435 43836     cutoff   40       319.60000  293.48944  8.17%  27.7  395s

 557615 43082  300.97362   34   77  319.60000  293.86825  8.05%  27.7  400s

 563530 41972  295.59967   29   72  319.60000  294.37294  7.89%  27.7  405s

 567662 41250  296.80705   50   21  319.60000  294.68973  7.79%  27.7  410s

 573761 40123  309.63272   44   23  319.60000  295.18477  7.64%  27.7  415s

 579142 39174  317.58327   46   30  319.60000  295.58288  7.51%  27.7  420s

 585201 38027  304.57894   27   31  319.60000  296.12525  7.35%  27.6  425s

 590558 36985     cutoff   41       319.60000  296.59760  7.20%  27.6  430s

 596696 35648  317.27118   45   55  319.60000  297.15133  7.02%  27.6  435s

 602920 34366  307.21825   41   24  319.60000  297.67494  6.86%  27.6  440s

 609055 33114     cutoff   43       319.60000  298.19195  6.70%  27.5  445s

 615187 31667  305.77368   37   16  319.60000  298.77597  6.52%  27.5  450s

 621228 30046  319.28728   47   48  319.60000  299.39248  6.32%  27.5  455s

 627203 28494  301.23217   46   61  319.60000  300.00473  6.13%  27.4  460s

 633381 26894  300.82834   29   54  319.60000  300.66638  5.92%  27.4  465s

 640327 24880  317.43509   37   18  319.60000  301.37869  5.70%  27.4  470s

 646398 22992  306.82459   47   14  319.60000  302.07375  5.48%  27.3  475s

 652581 21061 infeasible   31       319.60000  302.83663  5.25%  27.3  480s

 659604 18546     cutoff   43       319.60000  303.85332  4.93%  27.2  485s

 665648 16228     cutoff   44       319.60000  304.78057  4.64%  27.2  490s

 672701 13518  310.66014   33   12  319.60000  306.02000  4.25%  27.1  495s

 679074 10872     cutoff   41       319.60000  307.33904  3.84%  27.1  500s

 685487  7894     cutoff   50       319.60000  308.89429  3.35%  27.0  505s

 692287  4324  316.60404   32   50  319.60000  311.55760  2.52%  26.9  510s



Cutting planes:

  Learned: 19

  Gomory: 34

  Lift-and-project: 39

  Cover: 323

  Implied bound: 290

  Projected implied bound: 23

  Clique: 215

  MIR: 261

  Mixing: 78

  StrongCG: 6

  Flow cover: 780

  GUB cover: 3

  Inf proof: 139

  Zero half: 663

  RLT: 77

  Relax-and-lift: 421



Explored 698822 nodes (18728266 simplex iterations) in 514.24 seconds (506.81 work units)

Thread count was 16 (of 16 available processors)



Solution count 10: 319.6 319.6 350.54 ... 380.9



Optimal solution found (tolerance 1.00e-04)

Best objective 3.196000000000e+02, best bound 3.196000000000e+02, gap 0.0000%



AMPL MP initial flat model has 1309 variables (0 integer, 1266 binary);

Objectives: 1 quadratic; 

Constraints:  536 linear; 10 quadratic;



AMPL MP final model has 1309 variables (0 integer, 1266 binary);

Objectives: 1 quadratic; 

Constraints:  536 linear; 10 quadratic;





-----RESULTS INFO-----
running_time:  514.328
TC.best_bound:  319.6
TC:  319.6
MIP Gap (%):  0
=== Vehicle Routes ===
Vehicle 1: 0 → 15
Vehicle 1: 1 → 22
Vehicle 1: 3 → 1
Vehicle 1: 15 → 3
Vehicle 2: 0 → 2
Vehicle 2: 2 → 17
Vehicle 2: 4 → 22
Vehicle 2: 17 → 4
Vehicle 3: 0 → 19
Vehicle 3: 19 → 22
Vehicle 4: 0 → 22

=== Full Vehicle Routes ===
Vehicle 1: 0 → 15 → 3 → 1 → 0 (92<100)
Vehicle 2: 0 → 2 → 17 → 4 → 0 (95<100)
Vehicle 3: 0 → 19 → 0 (22<100)
Vehicle 4: 0 → 0 (0<100)
Arc used by MRT line: y variables:
MRT used: 15 → 16
MRT used: 17 → 18
Customer assigment to PL: u variables:
5 17
6 17
7 16
8 18
9 16
10 15
11 17
12 15
13 19
14 16
Node is served by regular vehicle: g variables:
1
2
3
4
15
17
19
Customer assigment to Home delivery: gm variables:
1
2
3
4
Node total demands: ntd variables:
1 13 1
2 24 1
3 12 1
4 13 1
10 0 0
11 0 0
12 0 0
13 0 0
14 0 0
21 0 0
15 67 1
16 0 0
17 58 1
18 0 0
19 22 1
20 0 0
Customer's demand delivered to PL: l variables:
5
6
7
8
9
10
11
12
13
14
Lockers load <= capacity:
0 <= 99
22 <= 84
45 <= 78
35 <= 76
23 <= 93
22 <= 70
0 <= 78
