Gurobi 12.0.3:   lim:time = 14400

  mip:bestbound = 1

Set parameter LogToConsole to value 1

  tech:outlev = 1

Set parameter Cuts to value 3

  cut:cuts = 3

Set parameter Presolve to value 2

  pre:solve = 2

Set parameter MIPFocus to value 2

  mip:focus = 2

Set parameter Symmetry to value 2

  mip:symmetry = 2

Set parameter InfUnbdInfo to value 1

Gurobi Optimizer version 12.0.3 build v12.0.3rc0 (win64 - Windows 11+.0 (26200.2))



CPU model: 13th Gen Intel(R) Core(TM) i7-13700K, instruction set [SSE2|AVX|AVX2]

Thread count: 16 physical cores, 24 logical processors, using up to 24 threads



Non-default parameters:

TimeLimit  14400

MIPFocus  2

Symmetry  2

Cuts  3

InfUnbdInfo  1

Presolve  2



Optimize a model with 584 rows, 1456 columns and 8544 nonzeros

Model fingerprint: 0xf68715b4

Model has 6 quadratic objective terms

Model has 10 quadratic constraints

Variable types: 45 continuous, 1411 integer (0 binary)

Coefficient statistics:

  Matrix range     [1e+00, 1e+05]

  QMatrix range    [1e+00, 1e+00]

  QLMatrix range   [1e+00, 1e+01]

  Objective range  [3e+00, 1e+02]

  QObjective range [2e+00, 2e+00]

  Bounds range     [1e+00, 1e+02]

  RHS range        [1e+00, 1e+05]

  QRHS range       [1e+02, 1e+02]

Presolve removed 31 rows and 94 columns

Presolve time: 0.27s

Presolved: 1462 rows, 2252 columns, 13924 nonzeros

Variable types: 437 continuous, 1815 integer (1736 binary)

Root relaxation presolve removed 29 rows and 4 columns

Root relaxation presolved: 1016 rows, 1831 columns, 24877 nonzeros





Root relaxation: objective 8.651772e+01, 243 iterations, 0.03 seconds (0.04 work units)



    Nodes    |    Current Node    |     Objective Bounds      |     Work

 Expl Unexpl |  Obj  Depth IntInf | Incumbent    BestBd   Gap | It/Node Time



     0     0   86.51772    0   45          -   86.51772      -     -    0s

H    0     0                     634.7100000   90.34653  85.8%     -    0s

     0     0  160.58000    0   66  634.71000  160.58000  74.7%     -    0s

H    0     0                     580.1300000  160.58000  72.3%     -    0s

     0     0  160.58000    0   75  580.13000  160.58000  72.3%     -    0s

     0     0  160.58000    0   71  580.13000  160.58000  72.3%     -    0s

H    0     0                     539.0300000  160.58000  70.2%     -    0s

     0     0  160.58000    0   34  539.03000  160.58000  70.2%     -    0s

     0     0  160.58000    0   34  539.03000  160.58000  70.2%     -    0s

H    0     0                     535.5900000  160.58000  70.0%     -    1s

H    0     0                     532.7400000  160.58000  69.9%     -    1s

H    0     0                     532.5100000  160.58000  69.8%     -    1s

H    0     0                     524.7400000  160.58000  69.4%     -    1s

H    0     0                     508.3300000  160.58000  68.4%     -    1s

H    0     0                     508.1700000  160.58000  68.4%     -    1s

H    0     0                     503.5400000  160.58000  68.1%     -    1s

H    0     0                     490.4700000  160.58000  67.3%     -    1s

H    0     0                     487.9200000  160.58000  67.1%     -    1s

     0     0  160.58000    0   35  487.92000  160.58000  67.1%     -    1s

     0     0  160.58000    0   36  487.92000  160.58000  67.1%     -    1s

H    0     0                     487.0700000  160.58083  67.0%     -    1s

H    0     0                     484.3100000  160.58083  66.8%     -    1s

     0     0  160.58263    0   77  484.31000  160.58263  66.8%     -    1s

     0     0  160.58263    0   76  484.31000  160.58263  66.8%     -    1s

H    0     0                     474.5500000  160.58263  66.2%     -    1s

     0     2  160.58263    0   55  474.55000  160.58263  66.2%     -    1s

H  296   301                     388.1400000  160.91448  58.5%  29.9    2s

H  379   396                     375.0600000  160.91448  57.1%  27.6    2s

H  391   396                     373.3000000  160.91448  56.9%  27.1    2s

H  480   506                     370.5400000  160.91448  56.6%  24.7    2s

H  892   813                     369.8700000  160.91806  56.5%  18.9    2s

H 1995  1616                     364.1700000  162.48526  55.4%  18.8    2s

H 2500  1849                     362.8000000  171.47125  52.7%  18.7    4s

H 2502  1757                     361.0500000  177.56027  50.8%  18.6    4s

  2507  1761  261.35375   18  124  361.05000  178.66573  50.5%  18.6    5s

H 2518  1680                     353.0100000  182.01139  48.4%  18.5    7s

H 2518  1595                     352.8000000  182.01139  48.4%  18.5    7s

H 2519  1516                     352.2500000  182.95536  48.1%  18.5    7s

H 2519  1440                     349.1100000  182.95536  47.6%  18.5    7s

  2557  1465  184.10123   19   89  349.11000  184.10123  47.3%  18.2   10s

H 2617  1456                     348.8600000  185.49584  46.8%  24.2   12s

H 3124  1682                     347.4700000  185.49584  46.6%  25.2   12s

H 4148  1917                     341.0800000  185.49584  45.6%  23.7   12s

H 4174  1844                     339.2900000  185.49584  45.3%  23.7   12s

H 4873  2018                     338.6500000  185.49584  45.2%  22.8   13s

H 7856  3541                     335.9400000  188.97931  43.7%  20.3   14s

H 9032  4136                     334.6400000  189.07971  43.5%  19.7   14s

 11059  5411     cutoff   77       334.64000  189.25382  43.4%  19.3   15s

 23133 11824  281.46217   45   54  334.64000  192.79215  42.4%  18.6   20s

 33591 16900  261.73982   54   48  334.64000  194.74636  41.8%  19.3   25s

 43404 21405  326.24393   49   40  334.64000  195.27546  41.6%  19.1   30s

 51188 24763  242.50783   51   60  334.64000  196.30293  41.3%  19.5   36s

 56923 27006  200.96467   36   91  334.64000  196.89444  41.2%  19.8   40s

 65109 30169  323.60438   49   37  334.64000  198.54742  40.7%  20.4   46s

 71376 32554  311.53056   57   39  334.64000  199.46442  40.4%  20.5   50s

 79223 35324 infeasible   43       334.64000  200.46093  40.1%  20.6   56s

 85552 37004  302.20192   56   38  334.64000  201.59093  39.8%  20.8   60s

 91522 39651  208.43688   49   54  334.64000  202.85392  39.4%  21.1   65s

 99888 42314  305.52500   50   70  334.64000  204.42967  38.9%  21.3   71s

 106259 45861  285.88786   50   24  334.64000  205.33000  38.6%  21.5   79s

 111648 46636  301.19372   49   66  334.64000  205.93133  38.5%  21.5   81s

 116175 48229  227.15170   45   48  334.64000  207.04498  38.1%  21.6   85s

*120290 48941              61     334.3500000  207.64553  37.9%  21.7   87s

 122189 49824  286.57020   45   64  334.35000  207.94235  37.8%  21.7   90s

H123329 49707                     332.1100000  207.94235  37.4%  21.7   90s

 128222 52026  241.65919   54   30  332.11000  209.01192  37.1%  21.9   96s

 133221 53292  243.77313   48   56  332.11000  209.95002  36.8%  21.9  102s

*133576 52638              45     326.1800000  209.95002  35.6%  21.9  102s

H136205 51570                     315.7300000  210.17296  33.4%  22.0  104s

 139585 51992 infeasible   62       315.73000  210.63885  33.3%  21.9  106s

 144371 53659  267.86867   43   52  315.73000  211.29329  33.1%  22.0  111s

 149947 55014  280.69332   47   60  315.73000  211.99872  32.9%  22.0  115s

 154924 56814  235.22870   39   65  315.73000  212.74936  32.6%  22.0  120s

 160136 58171     cutoff   51       315.73000  213.60606  32.3%  22.0  125s

 168602 60477  246.10903   49   19  315.73000  214.82044  32.0%  22.0  132s

 174176 61467  251.39148   54   35  315.73000  215.57004  31.7%  22.0  136s

 177670 62869  278.39369   47   37  315.73000  215.96569  31.6%  22.1  140s

 186424 64224     cutoff   49       315.73000  216.79636  31.3%  22.1  145s

 192360 66093  267.29652   48   79  315.73000  217.96693  31.0%  22.1  151s

 198890 67205  249.47231   48   54  315.73000  219.16486  30.6%  22.2  155s

 206309 68632  225.58250   43   42  315.73000  220.26056  30.2%  22.2  161s

 211130 69604  275.85927   42   47  315.73000  221.17861  29.9%  22.3  165s

 215552 70975  285.08547   53   43  315.73000  221.95651  29.7%  22.3  170s

 224159 72445  241.07721   42   78  315.73000  223.27621  29.3%  22.4  176s

 228415 73547  313.98697   51   48  315.73000  223.99065  29.1%  22.5  180s

 234839 74548  283.58562   51   36  315.73000  224.90500  28.8%  22.5  185s

 238314 75777     cutoff   39       315.73000  225.56380  28.6%  22.5  190s

 246768 77289  267.88048   53   58  315.73000  226.77928  28.2%  22.6  197s

 250630 77800  227.40004   41   28  315.73000  227.20474  28.0%  22.6  200s

 256219 78973  308.21968   54   60  315.73000  227.77244  27.9%  22.6  205s

 262020 80199  232.88798   45   58  315.73000  228.53934  27.6%  22.6  210s

 268133 81408 infeasible   52       315.73000  229.08980  27.4%  22.6  216s

 270562 81732  259.92255   48   88  315.73000  229.35333  27.4%  22.6  220s

 275924 82727  250.96342   45   67  315.73000  230.01888  27.1%  22.6  225s

 280157 83609  251.44844   46   60  315.73000  230.60000  27.0%  22.7  231s

 285827 84071 infeasible   61       315.73000  231.33819  26.7%  22.7  235s

 290489 85100  313.33940   73   37  315.73000  231.87291  26.6%  22.7  240s

 295167 85486 infeasible   52       315.73000  232.45664  26.4%  22.7  245s

 299835 86302  278.02545   55   46  315.73000  232.73545  26.3%  22.7  250s

 304794 86857  300.74050   50   68  315.73000  233.68829  26.0%  22.8  255s

 309682 87449     cutoff   56       315.73000  234.26369  25.8%  22.7  261s

 314183 87782  292.03145   44   33  315.73000  234.84046  25.6%  22.8  266s

 315699 88381  303.46623   57   41  315.73000  234.97631  25.6%  22.8  271s

 322268 88635  283.27160   57   26  315.73000  235.82098  25.3%  22.8  276s

 324158 89015  273.40759   39   86  315.73000  236.05951  25.2%  22.8  280s

 329630 89755  238.41803   53   52  315.73000  236.77712  25.0%  22.9  286s

 334618 90180  270.13653   53   79  315.73000  237.40391  24.8%  22.9  292s

 339828 90452  266.93366   46   84  315.73000  238.16399  24.6%  22.9  297s

 341290 90696     cutoff   40       315.73000  238.39250  24.5%  23.0  301s

 347327 90878  260.70047   44  102  315.73000  239.20751  24.2%  23.0  306s

 349375 90971  279.49714   55   84  315.73000  239.54923  24.1%  23.1  310s

 354398 91173  280.49122   58   23  315.73000  240.30000  23.9%  23.1  316s

 357922 91365  245.81091   51   37  315.73000  240.69967  23.8%  23.1  320s

 362515 91699  314.36667   58   16  315.73000  241.38337  23.5%  23.2  326s

 367497 92098  243.60861   43   87  315.73000  241.91227  23.4%  23.2  333s

 371572 92160  271.00209   45   53  315.73000  242.35300  23.2%  23.3  336s

 375757 92225     cutoff   50       315.73000  243.01877  23.0%  23.3  342s

 378266 92243  294.73086   50   48  315.73000  243.30076  22.9%  23.3  345s

 383729 92641  294.71347   53   51  315.73000  243.97987  22.7%  23.4  351s

 387251 92707  306.06615   45   48  315.73000  244.36643  22.6%  23.5  357s

 389261 92777  271.00646   54   27  315.73000  244.59250  22.5%  23.5  360s

 394022 92988  245.33271   53   35  315.73000  245.18653  22.3%  23.5  365s

 397927 92990  281.70987   42   62  315.73000  245.67444  22.2%  23.6  371s

 402858 93174  267.21175   47   35  315.73000  246.25339  22.0%  23.6  377s

 405847 93109  269.49020   54   33  315.73000  246.45523  21.9%  23.6  380s

 410061 93083  280.48000   38   16  315.73000  247.11661  21.7%  23.7  385s

 412566 93034  277.65603   65   29  315.73000  247.27000  21.7%  23.7  392s

 415018 92919     cutoff   49       315.73000  247.45872  21.6%  23.8  395s

 419709 92733     cutoff   59       315.73000  248.17339  21.4%  23.8  402s

 422128 92721  296.23698   46   47  315.73000  248.81953  21.2%  23.9  406s

 424682 92627  295.31182   57   49  315.73000  249.17613  21.1%  23.9  410s

 429960 92450  279.27583   49   50  315.73000  250.00758  20.8%  24.0  417s

 432615 92327     cutoff   54       315.73000  250.28068  20.7%  24.0  421s

 437794 92314  271.49845   52   62  315.73000  250.96237  20.5%  24.1  428s

 440302 92424  265.61100   49   52  315.73000  251.43615  20.4%  24.1  431s

 444681 92391 infeasible   58       315.73000  252.02667  20.2%  24.2  437s

 446455 92404  288.33881   56   40  315.73000  252.25000  20.1%  24.2  440s

 451888 92455  286.46478   55   41  315.73000  252.78691  19.9%  24.2  447s

 453797 92426 infeasible   66       315.73000  253.00507  19.9%  24.3  450s

 458527 92580  272.67333   52   50  315.73000  253.55167  19.7%  24.3  458s

 462027 92441 infeasible   71       315.73000  253.82223  19.6%  24.3  461s

 464991 92291  296.69648   51   34  315.73000  254.13126  19.5%  24.4  465s

 467863 92196  275.99370   50   57  315.73000  254.35869  19.4%  24.4  471s

 472554 92220  283.66838   58   68  315.73000  255.07366  19.2%  24.5  479s

 476221 92095  290.81000   49   37  315.73000  255.34177  19.1%  24.5  482s

 477817 91929  262.02869   58   33  315.73000  255.55535  19.1%  24.5  485s

 483127 91782     cutoff   47       315.73000  256.10216  18.9%  24.5  493s

 486784 91782 infeasible   66       315.73000  256.56370  18.7%  24.6  497s

 488743 91698     cutoff   43       315.73000  256.84265  18.7%  24.6  500s

 493686 91588 infeasible   62       315.73000  257.31243  18.5%  24.6  508s

 497109 91422  289.22212   62   57  315.73000  257.70252  18.4%  24.7  511s

 501509 91325  294.68625   44   41  315.73000  258.18405  18.2%  24.7  518s

 504947 91180  287.88998   56   44  315.73000  258.55519  18.1%  24.7  521s

 508975 90875 infeasible   54       315.73000  258.88858  18.0%  24.8  528s

 511678 90826  263.68595   47   12  315.73000  259.25741  17.9%  24.8  532s

 514058 90638  283.42784   50   65  315.73000  259.47052  17.8%  24.8  535s

 519047 90425  280.64369   43   57  315.73000  260.00059  17.7%  24.8  543s

 521769 90310  301.33250   45   60  315.73000  260.31536  17.6%  24.9  547s

 524153 90085 infeasible   49       315.73000  260.53357  17.5%  24.9  551s

 526757 90002 infeasible   58       315.73000  260.81432  17.4%  24.9  556s

 529488 89884     cutoff   62       315.73000  261.04775  17.3%  24.9  560s

 534249 89590  280.78480   54   13  315.73000  261.51535  17.2%  24.9  568s

 536683 89431  299.77823   60   39  315.73000  261.77703  17.1%  25.0  572s

 539358 89265     cutoff   55       315.73000  262.11632  17.0%  25.0  576s

 541780 89096  282.28421   46   78  315.73000  262.39398  16.9%  25.0  580s

 546615 88816     cutoff   49       315.73000  262.71643  16.8%  25.0  585s

 547464 88550  284.62929   48   42  315.73000  262.99710  16.7%  25.0  591s

 549719 88371  282.81968   51   58  315.73000  263.24633  16.6%  25.1  595s

 555106 87829  285.85439   45   71  315.73000  263.85618  16.4%  25.1  603s

 557528 87555     cutoff   54       315.73000  264.10449  16.4%  25.1  607s

 560274 87196 infeasible   58       315.73000  264.43578  16.2%  25.1  611s

 562653 87028     cutoff   51       315.73000  264.68438  16.2%  25.2  615s

 565304 86816  278.30269   41   16  315.73000  265.01591  16.1%  25.2  620s

 570491 86162 infeasible   49       315.73000  265.59425  15.9%  25.2  628s

 573105 85924     cutoff   49       315.73000  265.85444  15.8%  25.2  632s

 575823 85714  272.48414   47   48  315.73000  266.15487  15.7%  25.2  636s

 578128 85441  274.61481   50   21  315.73000  266.42229  15.6%  25.2  640s

 582051 84970  306.05391   63   72  315.73000  266.88593  15.5%  25.3  648s

 584561 84540  284.88025   45   48  315.73000  267.12000  15.4%  25.3  652s

 587446 84333  302.93612   50   71  315.73000  267.38819  15.3%  25.3  656s

 589917 83980  271.32268   57   39  315.73000  267.63324  15.2%  25.3  660s

 594333 83684  271.52209   57   46  315.73000  267.93030  15.1%  25.4  665s

 597830 83026     cutoff   51       315.73000  268.47494  15.0%  25.4  673s

 600557 82833  297.74390   53   70  315.73000  268.75870  14.9%  25.4  678s

 602938 82435     cutoff   49       315.73000  269.03061  14.8%  25.4  682s

 605411 82055  286.06494   49   62  315.73000  269.25677  14.7%  25.4  686s

 608169 81671  294.99481   66   53  315.73000  269.49385  14.6%  25.4  691s

 610486 81267  298.33931   39   15  315.73000  269.77168  14.6%  25.5  695s

 615378 80344     cutoff   43       315.73000  270.37643  14.4%  25.5  703s

 617879 79805     cutoff   55       315.73000  270.62817  14.3%  25.5  707s

 620461 79335 infeasible   48       315.73000  270.91630  14.2%  25.5  711s

 622763 78959  285.93970   65   75  315.73000  271.16361  14.1%  25.6  716s

 625440 78545  288.35994   49   74  315.73000  271.50430  14.0%  25.6  720s

 630231 77421     cutoff   54       315.73000  271.93024  13.9%  25.6  729s

 632876 76863  294.00244   59   65  315.73000  272.32391  13.7%  25.6  733s

 635329 76203     cutoff   51       315.73000  272.57637  13.7%  25.7  737s

 637788 75563  314.24432   53   37  315.73000  272.90857  13.6%  25.7  741s

 640465 74870  292.51201   44   58  315.73000  273.23639  13.5%  25.7  745s

 642823 74249  297.43699   58   55  315.73000  273.56977  13.4%  25.7  750s

 647814 72991  277.48354   52   56  315.73000  274.27000  13.1%  25.8  759s

 650178 72342  296.17624   46   46  315.73000  274.52806  13.0%  25.8  763s

 652812 71775  298.06280   57   38  315.73000  274.89544  12.9%  25.8  768s

 655158 71217 infeasible   74       315.73000  275.20035  12.8%  25.8  772s

 657605 70506  311.22211   42   42  315.73000  275.50648  12.7%  25.9  777s

 660133 69795     cutoff   57       315.73000  275.73259  12.7%  25.9  782s

 662860 69136  284.36627   52   65  315.73000  276.16135  12.5%  25.9  787s

 665274 68379     cutoff   62       315.73000  276.48554  12.4%  25.9  791s

 667714 67685  296.81259   62   78  315.73000  276.83792  12.3%  25.9  796s

 670352 67051     cutoff   70       315.73000  277.19052  12.2%  25.9  801s

 672745 66360     cutoff   46       315.73000  277.47585  12.1%  26.0  806s

 675275 65545     cutoff   46       315.73000  277.81044  12.0%  26.0  811s

 677861 64783  310.43329   47   71  315.73000  278.17398  11.9%  26.0  816s

 680366 64034  307.58733   57   62  315.73000  278.51471  11.8%  26.0  820s

 682755 63218 infeasible   53       315.73000  278.85456  11.7%  26.0  825s

 685315 62474  298.95333   47   27  315.73000  279.16724  11.6%  26.1  830s

 687689 61699  282.78730   47   67  315.73000  279.56167  11.5%  26.1  836s

 690307 60871     cutoff   57       315.73000  279.93000  11.3%  26.1  840s

 692702 60075  305.53337   58   71  315.73000  280.23438  11.2%  26.1  845s

 695165 59254     cutoff   36       315.73000  280.65541  11.1%  26.1  850s

 697650 58401     cutoff   49       315.73000  281.01318  11.0%  26.2  855s

 700342 57538  294.28840   54   64  315.73000  281.35701  10.9%  26.2  860s

 702727 56721  291.94500   44   18  315.73000  281.64913  10.8%  26.2  865s

 706654 55365     cutoff   50       315.73000  282.19125  10.6%  26.2  874s

 709116 54279  292.60965   65   61  315.73000  282.46241  10.5%  26.2  880s

 712142 53371  303.04730   49   77  315.73000  283.07730  10.3%  26.2  885s

 714738 52386     cutoff   46       315.73000  283.51214  10.2%  26.3  890s

 717346 51365     cutoff   65       315.73000  283.95430  10.1%  26.3  895s

 720048 50337  307.60443   58   20  315.73000  284.44000  9.91%  26.3  900s

 722539 49384 infeasible   47       315.73000  284.75191  9.81%  26.3  905s

 725323 48206 infeasible   47       315.73000  285.25073  9.65%  26.3  910s

 727729 47074  299.88007   52   42  315.73000  285.72721  9.50%  26.3  915s

 730210 45955     cutoff   53       315.73000  286.10250  9.38%  26.3  920s

 732827 44857  309.08971   43   35  315.73000  286.64597  9.21%  26.3  925s

 735506 43751  291.77758   39   57  315.73000  287.07518  9.08%  26.4  930s

 740512 41287 infeasible   56       315.73000  287.96425  8.79%  26.4  939s

 743101 40005  312.62038   52   53  315.73000  288.61802  8.59%  26.4  944s

 745560 38637  306.60421   52   47  315.73000  289.11463  8.43%  26.4  949s

 748038 37421     cutoff   54       315.73000  289.57072  8.29%  26.4  953s

 750619 36208 infeasible   56       315.73000  290.06776  8.13%  26.4  958s

 753020 34748     cutoff   57       315.73000  290.68719  7.93%  26.4  963s

 755691 33418  305.33105   50   82  315.73000  291.23264  7.76%  26.4  968s

 758526 32011  302.63440   62   71  315.73000  291.79263  7.58%  26.4  974s

 761224 30589 infeasible   44       315.73000  292.33431  7.41%  26.4  978s

 763852 29199 infeasible   62       315.73000  293.05066  7.18%  26.4  983s

 766508 27842 infeasible   60       315.73000  293.66000  6.99%  26.4  988s

 768980 26493  305.38905   56   56  315.73000  294.32088  6.78%  26.4  993s

 771642 25280 infeasible   67       315.73000  294.84803  6.61%  26.4  998s

 774328 24000     cutoff   63       315.73000  295.32977  6.46%  26.4 1003s

 776964 22514     cutoff   51       315.73000  296.17000  6.20%  26.4 1008s

 779664 21053  302.84544   57   61  315.73000  296.77391  6.00%  26.4 1013s

 782487 19551 infeasible   51       315.73000  297.42419  5.80%  26.4 1018s

 785139 18010     cutoff   74       315.73000  298.40000  5.49%  26.4 1023s

 787895 16633  300.10224   52   20  315.73000  299.16657  5.25%  26.3 1028s

 790630 15020 infeasible   58       315.73000  299.89732  5.01%  26.3 1033s

 793210 13130     cutoff   67       315.73000  300.79027  4.73%  26.3 1037s

 795904 11246     cutoff   66       315.73000  302.04000  4.34%  26.3 1041s

 798710  9525     cutoff   58       315.73000  303.14214  3.99%  26.3 1046s

 801432  7274  311.30657   48   70  315.73000  304.21183  3.65%  26.3 1051s

 804440  5006 infeasible   60       315.73000  305.89160  3.12%  26.2 1056s

 807469  2502  308.21000   50   19  315.73000  307.75922  2.52%  26.2 1061s

 812078     0     cutoff   50       315.73000  310.33280  1.71%  26.1 1065s



Cutting planes:

  Learned: 17

  Gomory: 44

  Lift-and-project: 10

  Cover: 324

  Implied bound: 207

  Projected implied bound: 12

  Clique: 218

  MIR: 106

  Mixing: 28

  Flow cover: 417

  GUB cover: 4

  Inf proof: 214

  Zero half: 775

  RLT: 52

  Relax-and-lift: 382



Explored 813292 nodes (21200522 simplex iterations) in 1066.06 seconds (225.70 work units)

Thread count was 24 (of 24 available processors)



Solution count 10: 315.73 315.73 326.18 ... 341.08



Optimal solution found (tolerance 1.00e-04)

Best objective 3.157300000000e+02, best bound 3.157300000000e+02, gap 0.0000%



AMPL MP initial flat model has 1456 variables (0 integer, 1411 binary);

Objectives: 1 quadratic; 

Constraints:  584 linear; 10 quadratic;



AMPL MP final model has 1456 variables (0 integer, 1411 binary);

Objectives: 1 quadratic; 

Constraints:  584 linear; 10 quadratic;





-----RESULTS INFO-----
running_time:  1066.281
TC.best_bound:  315.73
TC:  315.73
MIP Gap (%):  0
=== Vehicle Routes ===
Vehicle 1: 0 → 2
Vehicle 1: 1 → 24
Vehicle 1: 2 → 4
Vehicle 1: 3 → 1
Vehicle 1: 4 → 21
Vehicle 1: 21 → 3
Vehicle 2: 0 → 17
Vehicle 2: 17 → 23
Vehicle 2: 20 → 24
Vehicle 2: 23 → 20
Vehicle 3: 0 → 24
Vehicle 4: 0 → 24

=== Full Vehicle Routes ===
Vehicle 1: 0 → 2 → 4 → 21 → 3 → 1 → 0 (97<100)
Vehicle 2: 0 → 17 → 23 → 20 → 0 (96<100)
Vehicle 3: 0 → 0 (0<100)
Vehicle 4: 0 → 0 (0<100)
Arc used by MRT line: y variables:
MRT used: 17 → 18
MRT used: 20 → 19
MRT used: 21 → 22
Customer assigment to PL: u variables:
5 18
6 21
7 23
8 21
9 19
10 19
11 22
12 18
13 20
14 22
15 23
16 22
Node is served by regular vehicle: g variables:
1
2
3
4
23
17
20
21
Customer assigment to Home delivery: gm variables:
1
2
3
4
Node total demands: ntd variables:
1 13 1
2 13 1
3 12 1
4 12 1
11 0 0
12 0 0
13 0 0
14 0 0
15 0 0
16 0 0
23 28 1
17 14 1
18 0 0
19 0 0
20 54 1
21 47 1
22 0 0
Customer's demand delivered to PL: l variables:
5
6
7
8
9
10
11
12
13
14
15
16
Lockers load <= capacity:
28 <= 75
0 <= 88
14 <= 73
44 <= 84
10 <= 78
17 <= 86
30 <= 93
