Gurobi 12.0.3:   lim:time = 14400

  mip:bestbound = 1

Set parameter LogToConsole to value 1

  tech:outlev = 1

Set parameter Cuts to value 3

  cut:cuts = 3

Set parameter Presolve to value 2

  pre:solve = 2

Set parameter MIPFocus to value 2

  mip:focus = 2

Set parameter Symmetry to value 2

  mip:symmetry = 2

Set parameter InfUnbdInfo to value 1

Gurobi Optimizer version 12.0.3 build v12.0.3rc0 (win64 - Windows 11+.0 (26200.2))



CPU model: 13th Gen Intel(R) Core(TM) i7-13700K, instruction set [SSE2|AVX|AVX2]

Thread count: 16 physical cores, 24 logical processors, using up to 24 threads



Non-default parameters:

TimeLimit  14400

MIPFocus  2

Symmetry  2

Cuts  3

InfUnbdInfo  1

Presolve  2



Optimize a model with 583 rows, 1455 columns and 8545 nonzeros

Model fingerprint: 0xda57609f

Model has 6 quadratic objective terms

Model has 10 quadratic constraints

Variable types: 44 continuous, 1411 integer (0 binary)

Coefficient statistics:

  Matrix range     [1e+00, 1e+05]

  QMatrix range    [1e+00, 1e+00]

  QLMatrix range   [1e+00, 2e+01]

  Objective range  [4e+00, 1e+02]

  QObjective range [2e+00, 2e+00]

  Bounds range     [1e+00, 1e+02]

  RHS range        [1e+00, 1e+05]

  QRHS range       [1e+02, 1e+02]

Presolve removed 27 rows and 91 columns

Presolve time: 0.30s

Presolved: 1397 rows, 2186 columns, 13652 nonzeros

Variable types: 437 continuous, 1749 integer (1670 binary)

Root relaxation presolve removed 28 rows and 5 columns

Root relaxation presolved: 1364 rows, 2176 columns, 26547 nonzeros





Root relaxation: objective 7.559195e+01, 299 iterations, 0.03 seconds (0.05 work units)



    Nodes    |    Current Node    |     Objective Bounds      |     Work

 Expl Unexpl |  Obj  Depth IntInf | Incumbent    BestBd   Gap | It/Node Time



     0     0   75.59195    0   64          -   75.59195      -     -    0s

H    0     0                     601.6800000   75.59195  87.4%     -    0s

H    0     0                     594.6200000   75.59195  87.3%     -    0s

H    0     0                     578.6900000  160.82667  72.2%     -    0s

     0     0  172.75350    0   73  578.69000  172.75350  70.1%     -    0s

     0     0  172.75350    0   62  578.69000  172.75350  70.1%     -    0s

     0     0  172.75350    0   62  578.69000  172.75350  70.1%     -    0s

H    0     0                     481.3800000  176.28514  63.4%     -    1s

     0     0  178.65277    0   51  481.38000  178.65277  62.9%     -    1s

     0     0  179.06825    0   69  481.38000  179.06825  62.8%     -    1s

     0     0  180.44167    0   80  481.38000  180.44167  62.5%     -    1s

     0     0  180.44167    0   85  481.38000  180.44167  62.5%     -    1s

H    0     0                     445.1700000  184.03789  58.7%     -    1s

H    0     0                     439.7700000  184.03789  58.2%     -    1s

H    0     0                     435.1100000  184.03789  57.7%     -    1s

H    0     0                     425.9000000  184.03789  56.8%     -    1s

     0     0  184.03789    0   87  425.90000  184.03789  56.8%     -    1s

     0     0  185.22512    0   85  425.90000  185.22512  56.5%     -    1s

H    0     0                     324.3500000  186.41548  42.5%     -    2s

     0     0  186.41548    0   59  324.35000  186.41548  42.5%     -    2s

     0     0  186.73000    0   57  324.35000  186.73000  42.4%     -    2s

H    0     0                     321.2000000  186.73000  41.9%     -    2s

     0     2  186.73000    0   57  321.20000  186.73000  41.9%     -    2s

H   35    46                     299.9700000  186.73000  37.8%   118    2s

H  944   775                     296.5300000  186.73000  37.0%  33.4    3s

H 1079   840                     295.4700000  186.73000  36.8%  32.5    3s

H 2114  1369                     289.4400000  186.84950  35.4%  32.2    4s

  3257  1901  234.07356   31   53  289.44000  191.64197  33.8%  34.7    5s

H 4037  2007                     288.8200000  195.44279  32.3%  34.8    8s

  4048  2014  219.29178   26  131  288.82000  195.44279  32.3%  34.7   10s

  6960  2445  266.52144   51   57  288.82000  199.83564  30.8%  40.7   15s

H 7113  2337                     288.5200000  199.83564  30.7%  40.6   15s

 15963  5356  249.54802   37   41  288.52000  210.17650  27.2%  35.7   20s

H20812  7923                     285.5700000  213.02287  25.4%  34.0   24s

H21435  7811                     279.1700000  213.03021  23.7%  34.0   24s

H23917  7905                     275.7300000  213.62469  22.5%  33.6   24s

 24733  8205  230.04917   37   61  275.73000  214.07000  22.4%  33.4   25s

 34933 10969  237.25704   30   59  275.73000  217.55461  21.1%  32.0   30s

 44419 13302 infeasible   42       275.73000  220.09748  20.2%  31.5   35s

 53322 15219  233.59531   33  104  275.73000  221.87635  19.5%  31.2   40s

 61136 16523  240.81077   31   87  275.73000  223.41302  19.0%  31.2   45s

 68377 17302  257.60467   34   39  275.73000  225.07093  18.4%  31.2   50s

 76202 18222     cutoff   30       275.73000  226.84021  17.7%  31.0   55s

 83391 18893  229.54891   33   81  275.73000  228.40048  17.2%  30.8   60s

 90073 19667  243.84684   43   42  275.73000  229.94865  16.6%  30.7   65s

 97683 19875  236.19577   49   32  275.73000  231.53951  16.0%  30.3   70s

 106131 20664  250.12857   49   18  275.73000  233.46394  15.3%  29.9   76s

 111770 21534  245.80958   48   30  275.73000  234.08338  15.1%  29.6   80s

 120192 22304  240.80643   51   31  275.73000  235.40400  14.6%  29.2   85s

 126812 22654 infeasible   43       275.73000  236.30715  14.3%  28.9   90s

 133595 23164  269.31337   49   16  275.73000  237.26038  14.0%  28.7   95s

 140299 23639  256.78549   55   62  275.73000  238.01890  13.7%  28.4  100s

 147550 23903     cutoff   41       275.73000  239.11293  13.3%  28.2  105s

 154529 24208 infeasible   63       275.73000  239.94439  13.0%  28.0  110s

 159677 24516 infeasible   48       275.73000  240.57938  12.7%  27.8  115s

 167064 24852  255.62333   52   47  275.73000  241.39000  12.5%  27.6  120s

 174447 25056     cutoff   46       275.73000  242.19261  12.2%  27.4  125s

 181118 25203 infeasible   40       275.73000  242.85849  11.9%  27.2  130s

 188050 25448     cutoff   41       275.73000  243.60000  11.7%  27.1  135s

 195105 25796     cutoff   48       275.73000  244.25641  11.4%  26.9  140s

 201863 25912 infeasible   35       275.73000  244.93893  11.2%  26.8  145s

 208156 26175  246.58849   46   30  275.73000  245.48502  11.0%  26.7  150s

 213533 26287 infeasible   40       275.73000  245.96715  10.8%  26.6  155s

 220604 26545  247.56333   57   48  275.73000  246.48308  10.6%  26.4  160s

 227802 26528 infeasible   47       275.73000  247.14892  10.4%  26.3  166s

 233285 26536     cutoff   51       275.73000  247.58000  10.2%  26.2  170s

 240452 26420  269.56505   52   34  275.73000  248.20186  10.0%  26.1  175s

 245880 26481  248.83038   59   21  275.73000  248.65685  9.82%  26.0  180s

 252584 26440  256.90739   50   52  275.73000  249.14659  9.64%  25.8  185s

 260017 26378  275.64403   46   37  275.73000  249.68482  9.45%  25.7  190s

 266851 26134 infeasible   39       275.73000  250.27978  9.23%  25.6  196s

 271917 26090  252.62226   46   53  275.73000  250.65633  9.09%  25.5  200s

 279063 25751 infeasible   46       275.73000  251.18500  8.90%  25.4  206s

 283468 25462  269.36000   50   34  275.73000  251.56000  8.77%  25.4  210s

 290826 25204  268.94329   32   47  275.73000  252.19778  8.53%  25.3  215s

 296086 24995 infeasible   53       275.73000  252.58250  8.39%  25.2  220s

 303255 24565  271.68285   39   30  275.73000  253.18159  8.18%  25.1  225s

 310199 23951  267.22219   46   42  275.73000  253.78331  7.96%  25.0  231s

 315515 23698 infeasible   36       275.73000  254.31869  7.77%  24.9  235s

 322169 23138  261.03842   59   43  275.73000  254.88583  7.56%  24.9  240s

 329040 22461 infeasible   47       275.73000  255.45113  7.35%  24.8  246s

 334542 21995 infeasible   71       275.73000  255.91000  7.19%  24.7  250s

 339720 21396 infeasible   52       275.73000  256.33333  7.03%  24.6  255s

 346542 20419  262.61795   56   18  275.73000  256.96985  6.80%  24.5  260s

 351972 19873 infeasible   60       275.73000  257.40916  6.64%  24.5  265s

 358951 18881  267.95684   42   66  275.73000  258.14053  6.38%  24.4  271s

 363926 18162  265.99534   54   18  275.73000  258.60143  6.21%  24.3  275s

 369537 17453 infeasible   48       275.73000  259.17755  6.00%  24.3  280s

 376765 16484  265.35317   58   22  275.73000  259.85722  5.76%  24.2  286s

 382087 15537  260.83602   50   36  275.73000  260.44000  5.55%  24.1  290s

 387192 14619  263.16400   55   17  275.73000  260.91610  5.37%  24.1  295s

 394266 13115 infeasible   46       275.73000  261.87046  5.03%  24.0  301s

 399287 12074  264.59200   44   30  275.73000  262.49051  4.80%  23.9  305s

 404739 10820  266.08800   38   29  275.73000  263.22000  4.54%  23.9  310s

 411415  8849  266.43952   57   36  275.73000  264.30383  4.14%  23.8  316s

 416703  7486     cutoff   69       275.73000  265.25666  3.80%  23.7  321s

 422409  5657 infeasible   40       275.73000  266.47184  3.36%  23.6  326s

 427734  3480  269.00470   59   69  275.73000  267.97429  2.81%  23.6  331s

 431495  1933 infeasible   60       275.73000  269.71667  2.18%  23.5  335s



Cutting planes:

  Learned: 19

  Gomory: 54

  Lift-and-project: 38

  Cover: 147

  Implied bound: 165

  Projected implied bound: 25

  Clique: 129

  MIR: 183

  Mixing: 20

  StrongCG: 1

  Flow cover: 566

  Inf proof: 121

  Zero half: 514

  RLT: 106

  Relax-and-lift: 201



Explored 436086 nodes (10193897 simplex iterations) in 338.05 seconds (178.41 work units)

Thread count was 24 (of 24 available processors)



Solution count 10: 275.73 275.73 279.17 ... 299.97



Optimal solution found (tolerance 1.00e-04)

Best objective 2.757300000000e+02, best bound 2.757300000000e+02, gap 0.0000%



AMPL MP initial flat model has 1455 variables (0 integer, 1411 binary);

Objectives: 1 quadratic; 

Constraints:  583 linear; 10 quadratic;



AMPL MP final model has 1455 variables (0 integer, 1411 binary);

Objectives: 1 quadratic; 

Constraints:  583 linear; 10 quadratic;





-----RESULTS INFO-----
running_time:  338.187
TC.best_bound:  275.73
TC:  275.72999999999996
MIP Gap (%):  2.0615609059880327e-14
=== Vehicle Routes ===
Vehicle 1: 0 → 1
Vehicle 1: 1 → 2
Vehicle 1: 2 → 20
Vehicle 1: 20 → 23
Vehicle 2: 0 → 4
Vehicle 2: 4 → 5
Vehicle 2: 5 → 19
Vehicle 2: 19 → 23
Vehicle 3: 0 → 3
Vehicle 3: 3 → 23
Vehicle 4: 0 → 23

=== Full Vehicle Routes ===
Vehicle 1: 0 → 1 → 2 → 20 → 0 (94<100)
Vehicle 2: 0 → 4 → 5 → 19 → 0 (96<100)
Vehicle 3: 0 → 3 → 0 (13<100)
Vehicle 4: 0 → 0 (0<100)
Arc used by MRT line: y variables:
MRT used: 20 → 21
Customer assigment to PL: u variables:
6 19
7 19
8 19
9 21
10 19
11 21
12 21
13 21
14 20
15 20
Node is served by regular vehicle: g variables:
1
2
3
4
5
19
20
Customer assigment to Home delivery: gm variables:
1
2
3
4
5
Node total demands: ntd variables:
1 13 1
2 12 1
3 13 1
4 12 1
5 23 1
11 0 0
12 0 0
13 0 0
14 0 0
15 0 0
22 0 0
16 0 0
17 0 0
18 0 0
19 61 1
20 69 1
21 0 0
Customer's demand delivered to PL: l variables:
6
7
8
9
10
11
12
13
14
15
Lockers load <= capacity:
0 <= 74
0 <= 76
0 <= 71
0 <= 86
61 <= 97
25 <= 83
44 <= 90
