Gurobi 12.0.0:   lim:time = 14400

  mip:bestbound = 1

Set parameter LogToConsole to value 1

  tech:outlev = 1

Set parameter Cuts to value 3

  cut:cuts = 3

Set parameter Presolve to value 2

  pre:solve = 2

Set parameter MIPFocus to value 2

  mip:focus = 2

Set parameter Symmetry to value 2

  mip:symmetry = 2

Set parameter InfUnbdInfo to value 1

Gurobi Optimizer version 12.0.0 build v12.0.0rc1 (win64 - Windows 11.0 (26100.2))



CPU model: 11th Gen Intel(R) Core(TM) i7-11700 @ 2.50GHz, instruction set [SSE2|AVX|AVX2|AVX512]

Thread count: 8 physical cores, 16 logical processors, using up to 16 threads



Non-default parameters:

TimeLimit  14400

MIPFocus  2

Symmetry  2

Cuts  3

InfUnbdInfo  1

Presolve  2



Optimize a model with 583 rows, 1453 columns and 8545 nonzeros

Model fingerprint: 0xee498bdc

Model has 4 quadratic objective terms

Model has 8 quadratic constraints

Variable types: 44 continuous, 1409 integer (0 binary)

Coefficient statistics:

  Matrix range     [1e+00, 1e+05]

  QMatrix range    [1e+00, 1e+00]

  QLMatrix range   [1e+00, 2e+01]

  Objective range  [4e+00, 1e+02]

  QObjective range [2e+00, 2e+00]

  Bounds range     [1e+00, 1e+02]

  RHS range        [1e+00, 1e+05]

  QRHS range       [1e+02, 1e+02]

Presolve removed 30 rows and 93 columns

Presolve time: 0.73s

Presolved: 1387 rows, 2180 columns, 13601 nonzeros

Variable types: 297 continuous, 1883 integer (1668 binary)

Root relaxation presolve removed 25 rows and 3 columns

Root relaxation presolved: 1357 rows, 2172 columns, 23736 nonzeros





Root relaxation: objective 7.683146e+01, 284 iterations, 0.10 seconds (0.04 work units)



    Nodes    |    Current Node    |     Objective Bounds      |     Work

 Expl Unexpl |  Obj  Depth IntInf | Incumbent    BestBd   Gap | It/Node Time



     0     0   76.83146    0   61          -   76.83146      -     -    1s

H    0     0                     610.5600000   76.83146  87.4%     -    1s

H    0     0                     506.5300000   76.83146  84.8%     -    1s

H    0     0                     464.0400000   82.70366  82.2%     -    1s

H    0     0                     458.0400000   82.70366  81.9%     -    1s

H    0     0                     456.0400000  150.82228  66.9%     -    1s

     0     0  174.69218    0  122  456.04000  174.69218  61.7%     -    1s

H    0     0                     449.0700000  174.69218  61.1%     -    2s

     0     0  174.69218    0  130  449.07000  174.69218  61.1%     -    2s

     0     0  174.69218    0  132  449.07000  174.69218  61.1%     -    2s

H    0     0                     441.7800000  174.69218  60.5%     -    2s

H    0     0                     441.5700000  174.69218  60.4%     -    2s

H    0     0                     432.0000000  185.68660  57.0%     -    2s

H    0     0                     393.5800000  185.68660  52.8%     -    2s

     0     0  186.73000    0   75  393.58000  186.73000  52.6%     -    2s

     0     0  186.73000    0   66  393.58000  186.73000  52.6%     -    2s

     0     0  186.73035    0  114  393.58000  186.73035  52.6%     -    3s

     0     0  186.73035    0  120  393.58000  186.73035  52.6%     -    3s

     0     0  186.73472    0  104  393.58000  186.73472  52.6%     -    4s

     0     0  186.73472    0  102  393.58000  186.73472  52.6%     -    4s

     0     2  186.73472    0   81  393.58000  186.73472  52.6%     -    4s

H  115   125                     375.2800000  186.73472  50.2%  50.7    4s

   160   163  198.44153   13   55  375.28000  186.73472  50.2%  44.4    5s

H  305   279                     367.0400000  186.73472  49.1%  39.8    5s

  2224  1411  214.95562   27  116  367.04000  190.88197  48.0%  31.8   10s

H 2235  1347                     362.3600000  191.51534  47.1%  31.7   15s

H 2235  1280                     348.9000000  191.51534  45.1%  31.7   15s

H 2239  1217                     340.1300000  191.54371  43.7%  31.6   17s

H 2239  1156                     323.9900000  191.54371  40.9%  31.6   17s

H 2239  1098                     313.5600000  191.54371  38.9%  31.6   17s

H 2239  1042                     307.1900000  191.54371  37.6%  31.6   17s

H 2239   990                     300.1000000  191.54371  36.2%  31.6   17s

H 2240   941                     297.1100000  191.54371  35.5%  31.6   18s

  2245   944  212.82777   20  130  297.11000  191.76441  35.5%  31.5   20s

  2262   956  257.90862   32  162  297.11000  195.02600  34.4%  31.3   25s

  2306   985  283.12407   26  196  297.11000  197.86655  33.4%  30.7   30s

  3205  1275  261.98204   61   37  297.11000  197.86655  33.4%  40.1   35s

  6381  2225  217.98361   39   76  297.11000  197.86655  33.4%  41.9   40s

  9869  3821  223.56215   29   88  297.11000  201.44915  32.2%  41.9   45s

 13242  5226  255.99667   30   62  297.11000  204.98368  31.0%  41.6   50s

 16202  6362  272.39187   51   53  297.11000  206.61102  30.5%  41.3   55s

 21394  8304     cutoff   31       297.11000  208.97545  29.7%  40.9   60s

 26035  9945  225.91042   29   57  297.11000  210.95423  29.0%  40.5   65s

 29671 11262  231.81369   38  104  297.11000  212.14964  28.6%  40.1   70s

 34260 12660 infeasible   45       297.11000  213.61049  28.1%  39.8   75s

 38295 13778     cutoff   51       297.11000  214.54956  27.8%  39.6   80s

 42101 14524     cutoff   34       297.11000  215.78620  27.4%  39.6   85s

 46492 15325  240.92544   43   60  297.11000  217.05904  26.9%  39.8   90s

 50410 16415  233.41530   42   85  297.11000  218.24628  26.5%  39.9   96s

 53760 17106  276.09837   34   59  297.11000  219.14841  26.2%  40.0  100s

 58277 18030     cutoff   44       297.11000  220.18712  25.9%  40.0  105s

 62656 18628  290.70287   30   99  297.11000  221.89529  25.3%  40.3  110s

 66883 19272     cutoff   45       297.11000  223.38348  24.8%  40.4  115s

 70407 19711     cutoff   39       297.11000  224.61976  24.4%  40.4  120s

 74385 20324     cutoff   40       297.11000  225.79168  24.0%  40.6  125s

 77918 20849  260.62444   50   72  297.11000  226.68745  23.7%  40.7  130s

 82344 21414  280.61331   45   23  297.11000  227.93108  23.3%  40.7  135s

 86760 21670  260.25833   49   47  297.11000  229.32364  22.8%  40.9  140s

 90299 21853 infeasible   48       297.11000  230.34670  22.5%  41.0  145s

 95209 22076  279.18969   42   79  297.11000  232.01065  21.9%  41.1  150s

 97815 22226  239.64017   46   96  297.11000  232.75241  21.7%  41.2  155s

 101832 22665     cutoff   44       297.11000  233.97948  21.2%  41.2  160s

 106231 23134  240.83911   53   43  297.11000  235.01197  20.9%  41.2  165s

 110601 23421 infeasible   44       297.11000  236.18200  20.5%  41.2  170s

 114825 23734  263.30353   56   24  297.11000  237.20633  20.2%  41.2  175s

 119177 24162 infeasible   55       297.11000  238.24050  19.8%  41.2  181s

 122565 24448  291.27538   35   34  297.11000  238.89585  19.6%  41.1  185s

 127213 24862  262.59775   62   54  297.11000  239.89135  19.3%  41.0  190s

 131620 25309  278.57182   55   85  297.11000  240.89778  18.9%  41.0  195s

 135093 25719  292.98800   44   49  297.11000  241.39707  18.8%  40.9  200s

 139644 26218  265.25896   42   52  297.11000  242.17197  18.5%  40.8  205s

 143867 26516  267.88370   45   58  297.11000  242.98137  18.2%  40.7  210s

 148222 27037  257.82214   43   35  297.11000  243.87576  17.9%  40.6  215s

 152549 27403 infeasible   49       297.11000  244.65273  17.7%  40.5  220s

 156787 27644  264.23727   46   51  297.11000  245.63322  17.3%  40.3  225s

 161043 28041  260.20434   46   63  297.11000  246.33579  17.1%  40.2  230s

 165023 28440 infeasible   54       297.11000  246.87817  16.9%  40.1  235s

 168864 28636     cutoff   30       297.11000  247.65250  16.6%  40.0  240s

 173385 29015  289.49722   43   26  297.11000  248.30869  16.4%  39.8  245s

 177863 29337     cutoff   52       297.11000  249.02314  16.2%  39.6  250s

 181363 29712  254.78000   50   44  297.11000  249.45447  16.0%  39.5  255s

 186459 30031  276.67082   49   56  297.11000  250.18160  15.8%  39.4  260s

 190778 30185  256.14946   55   72  297.11000  250.78328  15.6%  39.2  265s

 193438 30307  262.72811   55   58  297.11000  251.11739  15.5%  39.2  270s

 197802 30637  263.73204   55   63  297.11000  251.77261  15.3%  39.1  275s

 202895 30885  273.92394   61   64  297.11000  252.42468  15.0%  39.0  280s

 206492 31016  255.72021   38   70  297.11000  252.88282  14.9%  38.8  285s

 210073 31150  292.14222   48   58  297.11000  253.46723  14.7%  38.7  290s

 214385 31338     cutoff   56       297.11000  254.08670  14.5%  38.6  295s

 218718 31417  280.78956   57   56  297.11000  254.66700  14.3%  38.5  300s

 223038 31488  262.97366   44   42  297.11000  255.34325  14.1%  38.4  305s

 227476 31483     cutoff   41       297.11000  255.96945  13.8%  38.3  310s

 231297 31439  260.34577   56   49  297.11000  256.51000  13.7%  38.2  316s

 234958 31361  290.62645   55   54  297.11000  257.01807  13.5%  38.1  320s

 239465 31235  285.57450   47   76  297.11000  257.69729  13.3%  38.0  325s

 243720 30979 infeasible   45       297.11000  258.34422  13.0%  37.9  330s

 248057 30840  268.39070   45   43  297.11000  258.97611  12.8%  37.8  335s

 252478 30736     cutoff   60       297.11000  259.56929  12.6%  37.7  340s

 256916 30600  271.06729   47   75  297.11000  260.10029  12.5%  37.6  345s

 261257 30387  272.33667   55   32  297.11000  260.72721  12.2%  37.5  350s

 265484 30071  284.74593   46   31  297.11000  261.27480  12.1%  37.4  355s

 269671 29834 infeasible   52       297.11000  261.85209  11.9%  37.2  360s

 274096 29552  268.60319   47   59  297.11000  262.44346  11.7%  37.1  365s

 279309 29141  279.25222   58   70  297.11000  263.16858  11.4%  37.0  370s

 283516 28746 infeasible   50       297.11000  263.73000  11.2%  36.9  375s

 287816 28235  268.60442   56   28  297.11000  264.31138  11.0%  36.8  380s

 291893 27708  277.37096   61   42  297.11000  264.87361  10.8%  36.7  385s

 296161 27189  282.95263   55   49  297.11000  265.51410  10.6%  36.6  390s

 300471 26671  267.20333   54   46  297.11000  266.15400  10.4%  36.5  395s

 304866 25961  273.88500   52   52  297.11000  266.89200  10.2%  36.4  400s

 308677 25527  271.59520   39   31  297.11000  267.46828  10.0%  36.3  405s

 312077 25016     cutoff   50       297.11000  267.95333  9.81%  36.2  410s

 316601 24470 infeasible   57       297.11000  268.61000  9.59%  36.1  415s

 321079 23703  271.94926   52   69  297.11000  269.34619  9.34%  36.0  420s

 325403 22926  288.83841   46   76  297.11000  270.08038  9.10%  36.0  425s

 329872 22003  274.85323   53   32  297.11000  270.87821  8.83%  35.9  430s

 334178 21278  290.16555   54   46  297.11000  271.61500  8.58%  35.8  435s

 337957 20392     cutoff   35       297.11000  272.25101  8.37%  35.7  440s

 341839 19633  292.29499   52   30  297.11000  273.03594  8.10%  35.7  445s

 346442 18779  279.43070   49   76  297.11000  273.84273  7.83%  35.6  450s

 350868 17941     cutoff   51       297.11000  274.69253  7.55%  35.5  455s

 355266 16927 infeasible   42       297.11000  275.46332  7.29%  35.4  461s

 358885 16358  296.13231   56   46  297.11000  276.17593  7.05%  35.4  465s

 364097 15057  286.39300   67   32  297.11000  277.19333  6.70%  35.3  470s

 368451 14025 infeasible   42       297.11000  278.17876  6.37%  35.2  475s

 372853 12935     cutoff   46       297.11000  279.16231  6.04%  35.1  480s

 377294 11809  282.76509   46   45  297.11000  280.19694  5.69%  35.1  485s

 380957 10741  292.19602   52   34  297.11000  281.07171  5.40%  35.0  491s

 384454  9875  287.53500   36   54  297.11000  281.93948  5.11%  35.0  495s

 389103  8578     cutoff   46       297.11000  283.17423  4.69%  34.9  500s

 393772  7234     cutoff   54       297.11000  284.44197  4.26%  34.8  505s

 398168  5723 infeasible   43       297.11000  285.86800  3.78%  34.7  510s

 402595  3857     cutoff   41       297.11000  287.62606  3.19%  34.6  515s

 407249  1260 infeasible   53       297.11000  290.86545  2.10%  34.5  520s



Cutting planes:

  Learned: 18

  Gomory: 34

  Lift-and-project: 44

  Cover: 188

  Implied bound: 223

  Projected implied bound: 73

  Clique: 170

  MIR: 128

  Mixing: 17

  StrongCG: 4

  Flow cover: 415

  GUB cover: 3

  Inf proof: 78

  Zero half: 569

  RLT: 103

  Relax-and-lift: 237



Explored 409853 nodes (14072874 simplex iterations) in 521.73 seconds (364.25 work units)

Thread count was 16 (of 16 available processors)



Solution count 10: 297.11 297.11 300.1 ... 367.04



Optimal solution found (tolerance 1.00e-04)

Best objective 2.971100000000e+02, best bound 2.971100000000e+02, gap 0.0000%

-----RESULTS INFO-----
running_time:  521.938
TC.best_bound:  297.11
TC:  297.11
MIP Gap (%):  0
=== Vehicle Routes ===
Vehicle 1: 0 → 3
Vehicle 1: 2 → 23
Vehicle 1: 3 → 4
Vehicle 1: 4 → 5
Vehicle 1: 5 → 16
Vehicle 1: 16 → 2
Vehicle 2: 0 → 1
Vehicle 2: 1 → 23
Vehicle 3: 0 → 19
Vehicle 3: 19 → 23
Vehicle 4: 0 → 23

=== Full Vehicle Routes ===
Vehicle 1: 0 → 3 → 4 → 5 → 16 → 2 → 0 (99<100)
Vehicle 2: 0 → 1 → 0 (13<100)
Vehicle 3: 0 → 19 → 0 (91<100)
Vehicle 4: 0 → 0 (0<100)
Arc used by MRT line: y variables:
MRT used: 16 → 17
MRT used: 19 → 18
Customer assigment to PL: u variables:
6 19
7 19
8 19
9 18
10 19
11 17
12 18
13 17
14 16
15 16
Node is served by regular vehicle: g variables:
1
2
3
4
5
16
19
Customer assigment to Home delivery: gm variables:
1
2
3
4
5
Node total demands: ntd variables:
1 13 1
2 12 1
3 13 1
4 12 1
5 23 1
11 0 0
12 0 0
13 0 0
14 0 0
15 0 0
22 0 0
16 39 1
17 0 0
18 0 0
19 91 1
20 0 0
21 0 0
Customer's demand delivered to PL: l variables:
6
7
8
9
10
11
12
13
14
15
Lockers load <= capacity:
0 <= 74
25 <= 76
14 <= 71
30 <= 86
61 <= 97
0 <= 83
0 <= 90
