Gurobi 12.0.3:   lim:time = 14400

  mip:bestbound = 1

Set parameter LogToConsole to value 1

  tech:outlev = 1

Set parameter Cuts to value 3

  cut:cuts = 3

Set parameter Presolve to value 2

  pre:solve = 2

Set parameter MIPFocus to value 2

  mip:focus = 2

Set parameter Symmetry to value 2

  mip:symmetry = 2

Set parameter InfUnbdInfo to value 1

Gurobi Optimizer version 12.0.3 build v12.0.3rc0 (win64 - Windows 11.0 (26100.2))



CPU model: 12th Gen Intel(R) Core(TM) i7-12700, instruction set [SSE2|AVX|AVX2]

Thread count: 12 physical cores, 20 logical processors, using up to 20 threads



Non-default parameters:

TimeLimit  14400

MIPFocus  2

Symmetry  2

Cuts  3

InfUnbdInfo  1

Presolve  2



Optimize a model with 584 rows, 1454 columns and 8544 nonzeros

Model fingerprint: 0x39a6055b

Model has 4 quadratic objective terms

Model has 8 quadratic constraints

Variable types: 45 continuous, 1409 integer (0 binary)

Coefficient statistics:

  Matrix range     [1e+00, 1e+05]

  QMatrix range    [1e+00, 1e+00]

  QLMatrix range   [1e+00, 1e+01]

  Objective range  [3e+00, 1e+02]

  QObjective range [2e+00, 2e+00]

  Bounds range     [1e+00, 1e+02]

  RHS range        [1e+00, 1e+05]

  QRHS range       [1e+02, 1e+02]

Presolve removed 34 rows and 96 columns

Presolve time: 0.48s

Presolved: 1452 rows, 2246 columns, 13878 nonzeros

Variable types: 297 continuous, 1949 integer (1734 binary)

Root relaxation presolve removed 25 rows and 3 columns

Root relaxation presolved: 1010 rows, 1826 columns, 22516 nonzeros





Root relaxation: objective 8.651772e+01, 206 iterations, 0.04 seconds (0.03 work units)



    Nodes    |    Current Node    |     Objective Bounds      |     Work

 Expl Unexpl |  Obj  Depth IntInf | Incumbent    BestBd   Gap | It/Node Time



     0     0   86.51772    0   62          -   86.51772      -     -    0s

     0     0  160.58000    0   59          -  160.58000      -     -    1s

H    0     0                     508.1400000  160.58000  68.4%     -    1s

     0     0  160.58000    0   88  508.14000  160.58000  68.4%     -    1s

     0     0  160.58000    0   88  508.14000  160.58000  68.4%     -    1s

     0     0  160.58024    0   54  508.14000  160.58024  68.4%     -    1s

     0     0  160.58024    0   69  508.14000  160.58024  68.4%     -    1s

H    0     0                     477.4200000  160.58024  66.4%     -    1s

H    0     0                     475.4200000  161.58662  66.0%     -    2s

     0     0  161.58662    0   88  475.42000  161.58662  66.0%     -    2s

     0     0  162.97312    0   88  475.42000  162.97312  65.7%     -    2s

H    0     0                     473.0300000  171.98100  63.6%     -    2s

     0     0  171.98100    0   70  473.03000  171.98100  63.6%     -    2s

     0     0  172.59000    0   70  473.03000  172.59000  63.5%     -    3s

     0     2  172.59000    0   70  473.03000  172.59000  63.5%     -    3s

H   51    64                     472.0000000  174.66667  63.0%  30.1    3s

H  253   259                     471.3800000  174.66667  62.9%  34.6    3s

H  254   259                     471.1400000  174.66667  62.9%  34.5    3s

* 1193  1021              55     452.9700000  175.36500  61.3%  22.0    4s

  2229  1723  214.25997   46  509  452.97000  179.09001  60.5%  21.5    5s

H 2245  1647                     447.3900000  180.43223  59.7%  21.4    7s

H 2245  1564                     446.5400000  180.43223  59.6%  21.4    7s

H 2245  1485                     430.7900000  180.43223  58.1%  21.4    7s

H 2245  1411                     421.5900000  180.43223  57.2%  21.4    7s

H 2245  1340                     408.0400000  180.43223  55.8%  21.4    7s

H 2251  1277                     407.4600000  182.80931  55.1%  21.3    8s

H 2252  1212                     393.2200000  182.80931  53.5%  21.3    8s

  2257  1216  203.33667   17   73  393.22000  182.80931  53.5%  21.2   10s

H 2290  1197                     383.4500000  182.80931  52.3%  24.0   12s

H 2299  1135                     369.1700000  182.80931  50.5%  24.0   12s

H 2346  1111                     353.7000000  182.80931  48.3%  24.6   12s

H 2347  1058                     352.4300000  182.80931  48.1%  24.6   12s

H 2384  1041                     350.9800000  182.80931  47.9%  24.9   12s

H 2652  1111                     348.8600000  182.80931  47.6%  27.0   13s

  4327  1590  305.49167   90   59  348.86000  183.03925  47.5%  29.4   15s

 13181  6706  275.02444   36   51  348.86000  188.99115  45.8%  28.2   20s

 20747 10533  208.98491   34   42  348.86000  192.22440  44.9%  27.9   25s

 28326 14700  276.82262   26   79  348.86000  194.76251  44.2%  27.7   30s

 36440 18128     cutoff   51       348.86000  195.13663  44.1%  27.6   35s

 43276 21031  259.06949   37   70  348.86000  196.43762  43.7%  27.8   40s

 49890 23513  238.65639   33   54  348.86000  197.86060  43.3%  28.2   45s

 56176 26177  329.11000   35   40  348.86000  198.97969  43.0%  28.6   50s

 62163 28644  219.92687   31  115  348.86000  200.06307  42.7%  28.8   55s

 69068 31292  327.79004   48   53  348.86000  201.03413  42.4%  29.1   60s

 75636 33664  263.45400   32   54  348.86000  202.21973  42.0%  29.3   65s

 82022 36249  280.73256   28   60  348.86000  203.28417  41.7%  29.4   70s

 89228 38721  211.17007   26   86  348.86000  204.56019  41.4%  29.5   75s

*90635 39132              38     348.3300000  204.77446  41.2%  29.5   76s

H92264 39400                     343.8400000  205.09132  40.4%  29.6   77s

 94446 40372     cutoff   37       343.84000  205.58894  40.2%  29.6   80s

 101589 42787  278.71032   48   46  343.84000  207.05778  39.8%  29.7   85s

 106752 44633  295.19601   45   66  343.84000  208.29049  39.4%  29.8   90s

 112701 46884  238.06884   35   35  343.84000  209.39253  39.1%  30.0   95s

 119341 49023  310.77405   33   54  343.84000  210.86531  38.7%  30.1  100s

 124028 50853  310.09607   35   66  343.84000  211.79903  38.4%  30.2  105s

 130012 53030  234.40870   32   76  343.84000  212.95907  38.1%  30.3  110s

H135532 54165                     338.1400000  214.08585  36.7%  30.4  113s

H136701 53646                     333.1500000  214.36453  35.7%  30.4  114s

H136755 52475                     327.6900000  214.36453  34.6%  30.4  114s

 137407 52843  223.34366   27   64  327.69000  214.62798  34.5%  30.4  115s

 143570 54657  323.39942   34   93  327.69000  216.09075  34.1%  30.5  120s

 149775 56368     cutoff   36       327.69000  217.43318  33.6%  30.6  126s

 153787 57428  297.31780   42   77  327.69000  218.31250  33.4%  30.6  130s

 158987 58728  237.85687   32   39  327.69000  219.59701  33.0%  30.7  135s

 163954 59898  255.02319   37   53  327.69000  220.65492  32.7%  30.7  140s

 168956 61253 infeasible   35       327.69000  221.77684  32.3%  30.7  145s

 174049 62428  243.64731   44   27  327.69000  222.70844  32.0%  30.8  150s

 179193 63525  296.06316   29   45  327.69000  223.53944  31.8%  30.8  155s

 184356 64611  294.67851   57   27  327.69000  224.56049  31.5%  30.8  160s

 189513 65642  291.75474   40   97  327.69000  225.69905  31.1%  30.8  165s

 194178 66729  323.78275   36   14  327.69000  226.70351  30.8%  30.9  170s

 200571 67931     cutoff   36       327.69000  228.14444  30.4%  30.9  176s

 205577 68767 infeasible   38       327.69000  229.29087  30.0%  31.0  180s

 210475 69579  263.57604   34   76  327.69000  230.25554  29.7%  31.1  185s

 216425 70693 infeasible   51       327.69000  231.51426  29.3%  31.1  190s

 221342 71419  258.49686   36   43  327.69000  232.49676  29.0%  31.2  195s

 227624 72314  317.20445   41   45  327.69000  233.99031  28.6%  31.3  201s

 232540 72984  282.42625   35   39  327.69000  235.18052  28.2%  31.3  205s

 237475 73683  254.88270   34   71  327.69000  236.36698  27.9%  31.4  210s

 243351 74581 infeasible   44       327.69000  237.63473  27.5%  31.5  216s

 248536 75299  304.67000   27   39  327.69000  238.77912  27.1%  31.6  221s

 253554 76056  299.36664   34   73  327.69000  239.88047  26.8%  31.6  225s

 258551 77010  290.29346   36   66  327.69000  240.81812  26.5%  31.7  230s

 261527 77667  317.85894   39   10  327.69000  240.94816  26.5%  31.7  235s

 267080 79244  249.00671   34   73  327.69000  241.88205  26.2%  31.8  241s

 271606 80058 infeasible   35       327.69000  242.46609  26.0%  31.9  245s

 277033 81198  277.67602   40   41  327.69000  243.09268  25.8%  31.9  251s

 282257 82390  252.19994   32   46  327.69000  243.56426  25.7%  32.0  256s

 286302 83218  296.89756   44   38  327.69000  243.92994  25.6%  32.0  260s

 291899 84416     cutoff   40       327.69000  244.45749  25.4%  32.0  265s

 296411 85292     cutoff   34       327.69000  244.99846  25.2%  32.0  270s

 302868 86163  301.51883   27   52  327.69000  245.80356  25.0%  32.1  275s

 307639 86984 infeasible   36       327.69000  246.34440  24.8%  32.1  280s

 312917 87616 infeasible   43       327.69000  246.96207  24.6%  32.1  285s

 317581 88479  288.63222   31   45  327.69000  247.45908  24.5%  32.1  290s

 322505 89406  258.50360   40   76  327.69000  248.06327  24.3%  32.1  295s

 327585 90076  263.98754   45   70  327.69000  248.62456  24.1%  32.1  300s

 332654 90551  289.86667   42   56  327.69000  249.24771  23.9%  32.2  305s

 337314 90922  313.45304   41   35  327.69000  249.84914  23.8%  32.2  311s

 341348 91134  293.77789   31   77  327.69000  250.40896  23.6%  32.3  315s

 345918 91443 infeasible   40       327.69000  251.10281  23.4%  32.3  320s

 351033 91840 infeasible   38       327.69000  251.71085  23.2%  32.4  325s

 355828 92194  298.29022   41   34  327.69000  252.35700  23.0%  32.5  331s

 359518 92549  292.11922   27   59  327.69000  252.75251  22.9%  32.5  335s

 364419 92761  261.18161   33   61  327.69000  253.41909  22.7%  32.6  340s

 369509 93190  290.87373   30  100  327.69000  254.00571  22.5%  32.7  346s

 373048 93346  296.45774   49   77  327.69000  254.50860  22.3%  32.8  350s

 378229 93789  305.16581   30   62  327.69000  255.07838  22.2%  32.9  356s

 381907 94086  282.98213   34   52  327.69000  255.54279  22.0%  32.9  360s

 385962 94255  294.00048   52   56  327.69000  256.00175  21.9%  33.0  365s

 390675 94366     cutoff   42       327.69000  256.61353  21.7%  33.0  370s

 394392 94534     cutoff   43       327.69000  257.07645  21.5%  33.1  375s

 397542 94562     cutoff   37       327.69000  257.37626  21.5%  33.2  380s

 402040 94653  289.77576   44   59  327.69000  257.99038  21.3%  33.2  386s

 406116 94709  315.20167   40   41  327.69000  258.52600  21.1%  33.3  390s

 409769 94835  302.90727   46   45  327.69000  258.96837  21.0%  33.3  395s

 413495 94920     cutoff   58       327.69000  259.40044  20.8%  33.4  400s

 418719 94918  299.92833   35   30  327.69000  260.07200  20.6%  33.4  406s

 422164 94770  310.03476   35   47  327.69000  260.47346  20.5%  33.5  410s

 425985 94600  319.50624   50   46  327.69000  261.01397  20.3%  33.6  415s

 429708 94351     cutoff   40       327.69000  261.51909  20.2%  33.6  420s

 433465 94039 infeasible   37       327.69000  262.10491  20.0%  33.7  425s

 438400 93659  308.68877   37   55  327.69000  262.85213  19.8%  33.8  431s

 441949 93330  308.43583   39   62  327.69000  263.40064  19.6%  33.9  436s

 445734 93139     cutoff   33       327.69000  263.94870  19.5%  33.9  440s

 449458 92830  269.99148   44   69  327.69000  264.50908  19.3%  34.0  445s

 453267 92497  323.22200   27   50  327.69000  265.13081  19.1%  34.1  450s

 458200 92072  313.53682   35   45  327.69000  265.80644  18.9%  34.1  456s

 461970 91840  318.95115   32   61  327.69000  266.33495  18.7%  34.2  460s

 465823 91517  305.13000   30   27  327.69000  266.81456  18.6%  34.3  465s

 469617 91095     cutoff   42       327.69000  267.35964  18.4%  34.3  470s

 474366 90666  297.92748   45   69  327.69000  268.04905  18.2%  34.4  476s

 478214 90258     cutoff   35       327.69000  268.60433  18.0%  34.5  480s

 481914 89757  287.92421   33   77  327.69000  269.10017  17.9%  34.5  485s

 485643 89398  310.91017   30   83  327.69000  269.60915  17.7%  34.6  490s

 488925 89050  283.31244   30   95  327.69000  270.08668  17.6%  34.7  495s

 492934 88476  287.80622   30   78  327.69000  270.60788  17.4%  34.7  500s

 496868 87867 infeasible   40       327.69000  271.09810  17.3%  34.8  505s

 500553 87180  316.54556   43   30  327.69000  271.72167  17.1%  34.8  510s

 504367 86595  280.87799   33   95  327.69000  272.34137  16.9%  34.9  515s

 508170 86038     cutoff   30       327.69000  272.87186  16.7%  35.0  520s

 511941 85438     cutoff   31       327.69000  273.47833  16.5%  35.0  525s

 515797 84850  289.46638   31   83  327.69000  274.03866  16.4%  35.1  530s

 519449 84104 infeasible   38       327.69000  274.54940  16.2%  35.1  535s

 523295 83357  307.91340   42   60  327.69000  275.12574  16.0%  35.2  540s

 527013 82564  301.44386   46   64  327.69000  275.80000  15.8%  35.2  545s

 530676 81926  306.22610   31   74  327.69000  276.28403  15.7%  35.3  550s

 535763 80841  300.94193   32   81  327.69000  277.12316  15.4%  35.4  556s

 539429 80196     cutoff   34       327.69000  277.69840  15.3%  35.4  561s

 543134 79432     cutoff   41       327.69000  278.28189  15.1%  35.5  566s

 547000 78392 infeasible   44       327.69000  278.87944  14.9%  35.5  571s

 550768 77483  323.72935   34   59  327.69000  279.60169  14.7%  35.6  576s

 554361 76615  310.37721   31   90  327.69000  280.15096  14.5%  35.6  581s

 558143 75657     cutoff   27       327.69000  280.73130  14.3%  35.7  585s

 563334 74312     cutoff   35       327.69000  281.56400  14.1%  35.7  590s

 568463 73089 infeasible   31       327.69000  282.34917  13.8%  35.8  596s

 571968 71937 infeasible   62       327.69000  283.03462  13.6%  35.8  600s

 576664 70607     cutoff   33       327.69000  283.85550  13.4%  35.9  605s

 582072 68971  304.63667   42   80  327.69000  284.83104  13.1%  35.9  611s

 585836 67711  318.00376   31   74  327.69000  285.51277  12.9%  35.9  615s

 590918 66101  303.86543   33   84  327.69000  286.41471  12.6%  36.0  620s

 596025 64321  299.09106   41   61  327.69000  287.35179  12.3%  36.0  625s

 601087 62423     cutoff   38       327.69000  288.38602  12.0%  36.0  631s

 606389 60524     cutoff   38       327.69000  289.40929  11.7%  36.1  636s

 610259 59009     cutoff   49       327.69000  290.18490  11.4%  36.1  640s

 615220 57038     cutoff   46       327.69000  291.23053  11.1%  36.1  645s

 620464 54933  296.33376   40   32  327.69000  292.30182  10.8%  36.1  650s

 625691 52868     cutoff   43       327.69000  293.35573  10.5%  36.1  655s

 630715 50861     cutoff   31       327.69000  294.32065  10.2%  36.1  660s

 636018 49092     cutoff   39       327.69000  295.32602  9.88%  36.1  665s

 641116 47214     cutoff   38       327.69000  296.27517  9.59%  36.1  670s

 644853 45691     cutoff   43       327.69000  296.99283  9.37%  36.1  675s

 650396 43670  323.09510   28   32  327.69000  298.11503  9.03%  36.1  681s

 654484 42078  313.93096   39   59  327.69000  298.92148  8.78%  36.1  685s

 659684 40128     cutoff   52       327.69000  299.96026  8.46%  36.0  690s

 665102 37854  315.65899   30   47  327.69000  301.09185  8.12%  36.0  695s

 670589 35702 infeasible   48       327.69000  302.22530  7.77%  35.9  700s

 675954 33540  319.08514   33   45  327.69000  303.45921  7.39%  35.9  705s

 681171 31121  305.56724   45   43  327.69000  304.62943  7.04%  35.8  710s

 686405 29091 infeasible   45       327.69000  305.81602  6.68%  35.7  715s

 691748 26878  325.54449   37   75  327.69000  307.07842  6.29%  35.7  721s

 695674 25397 infeasible   31       327.69000  307.88445  6.04%  35.6  725s

 700925 23633  316.03212   31   63  327.69000  308.95413  5.72%  35.6  730s

 706046 21982  322.71083   36   54  327.69000  310.00378  5.40%  35.5  735s

 711475 19959  319.75881   38   85  327.69000  311.12522  5.06%  35.4  741s

 715438 18651     cutoff   53       327.69000  312.03075  4.78%  35.3  745s

 720645 16533  321.16534   38   49  327.69000  313.10252  4.45%  35.2  750s

 726166 14041     cutoff   50       327.69000  314.62662  3.99%  35.2  756s

 730162 12128 infeasible   40       327.69000  315.78310  3.63%  35.1  760s

 735490  9322     cutoff   40       327.69000  317.41750  3.13%  35.0  765s

 740623  6401     cutoff   48       327.69000  319.20839  2.59%  34.9  770s

 744810  3835     cutoff   40       327.69000  321.04000  2.03%  34.8  775s



Cutting planes:

  Learned: 19

  Gomory: 58

  Lift-and-project: 71

  Cover: 324

  Implied bound: 206

  Projected implied bound: 17

  Clique: 145

  MIR: 227

  Mixing: 78

  StrongCG: 13

  Flow cover: 812

  GUB cover: 1

  Inf proof: 183

  Zero half: 1046

  RLT: 86

  Relax-and-lift: 349



Explored 750577 nodes (26012687 simplex iterations) in 780.22 seconds (453.84 work units)

Thread count was 20 (of 20 available processors)



Solution count 10: 327.69 327.69 333.15 ... 353.7



Optimal solution found (tolerance 1.00e-04)

Best objective 3.276900000000e+02, best bound 3.276900000000e+02, gap 0.0000%



AMPL MP initial flat model has 1454 variables (0 integer, 1409 binary);

Objectives: 1 quadratic; 

Constraints:  584 linear; 8 quadratic;



AMPL MP final model has 1454 variables (0 integer, 1409 binary);

Objectives: 1 quadratic; 

Constraints:  584 linear; 8 quadratic;





-----RESULTS INFO-----
running_time:  780.329
TC.best_bound:  327.69
TC:  327.69
MIP Gap (%):  0
=== Vehicle Routes ===
Vehicle 1: 0 → 1
Vehicle 1: 1 → 3
Vehicle 1: 2 → 24
Vehicle 1: 3 → 17
Vehicle 1: 4 → 2
Vehicle 1: 17 → 4
Vehicle 2: 0 → 23
Vehicle 2: 20 → 24
Vehicle 2: 23 → 20
Vehicle 3: 0 → 24
Vehicle 4: 0 → 24

=== Full Vehicle Routes ===
Vehicle 1: 0 → 1 → 3 → 17 → 4 → 2 → 0 (97<100)
Vehicle 2: 0 → 23 → 20 → 0 (96<100)
Vehicle 3: 0 → 0 (0<100)
Vehicle 4: 0 → 0 (0<100)
Arc used by MRT line: y variables:
MRT used: 17 → 18
MRT used: 20 → 19
Customer assigment to PL: u variables:
5 18
6 20
7 23
8 17
9 19
10 19
11 18
12 18
13 20
14 19
15 20
16 19
Node is served by regular vehicle: g variables:
1
2
3
4
23
17
20
Customer assigment to Home delivery: gm variables:
1
2
3
4
Node total demands: ntd variables:
1 13 1
2 13 1
3 12 1
4 12 1
11 0 0
12 0 0
13 0 0
14 0 0
15 0 0
16 0 0
23 26 1
17 47 1
18 0 0
19 0 0
20 70 1
21 0 0
22 0 0
Customer's demand delivered to PL: l variables:
5
6
7
8
9
10
11
12
13
14
15
16
Lockers load <= capacity:
26 <= 75
12 <= 88
35 <= 73
53 <= 84
17 <= 78
0 <= 86
0 <= 93
